spam/ham,message
1,تازہ ترین نوکیا موبائل یا آئی پوڈ، MP3 پلیئر + ایک ¥ Â £ 400 proze گارنٹیڈ! اب 83355 کو جیت: کے ساتھ جواب دیں! Norcorp Ltd.Ã ¥ Â £ 1،50 / Mtmsgrcvd18 +
1,ایس ایم ایس کی خدمات. آپ کے ساتھ لے کر چلنے کا متن کریڈٹس، کو روکنے کے، بغیر کسی اضافی چارج کے ساتھ pls ​​ہم گوٹو www.comuk.net لاگ ان = 3qxj9 رکنیت ختم کی. مدد کی 08702840625.COMUK. 220-CM2 9AE
0,Nvm الرحمن وقت لگے.
0,لہذا دا فیصلے اور Wat ہے؟
0,WOT یو منحصر ہے 2 پھر کتیا؟
0,ممکن نہیں Stupid.its
0,وہ HR کو بتایا کہ وہ چنئی میں پوسٹنگ چاہتے ہیں کہ:) میں یہاں کام کر رہا ہوں کیونکہ :)
1,موبائل کلب: آپ کے موبائل کے لئے سب سے اوپر معیار کی اشیاء میں سے کسی کا انتخاب کریں. 7cfca1a
0,تم لوگ کب چھوڑ رہے ہیں؟
0,انہوں نیوا بنبنانا لیکن مجھے دکھ ہے Lor ... ہی ... ابھی TMR ہے Lor پچھاڑی دوپہر کے کھانے کے. لیکن ہم اب بھی ایک نہ TMR 4 دوپہر کے کھانے meetin. ان لئی FR سنتے نیوا. ایک کام کے AR کی ایک بہت ہے؟
0,کچھ بھی کرنے کے قابل نہیں.
0,ایک Takin اور لکیری الجبرا آج؟
0,اس ویک اینڈ فائن (عذر بہت زیادہ سجاوٹ کرنے کے لئے نہیں ہے)
0,معاف کیجئے گا میں آپ کو Babe یاد کیا. مجھے دیر تک تھا اور میں سو گیا. میں نے آپ کو آپ کی ڈرائیونگ کے سبق، کے boytoy لطف اندوز امید. میں نے ... * چڑھا بوسہ بھی تمہیں یاد *
0,ابھی PA منصوبے. اس کے بعد صرف میں آ سکتے ہیں.
1,منی میں نے نمبر 946 WOT میں اگلے کرنا ایسا WINING جیت گئے
0,ضرور، آپ چپ & GT دکھاتے ہیں جب بھی؛ :(
0,یہ بے ترتیب وآلہ کیمپس میں میرے پرانے اس Roomate تھا. اس نے ڈگری کر لی
1,مبارک ہو! 2 موبائل 3G Videophones R تمہارا. اب 09061744553 پر کال کریں! غلط wid سے الرحمن ساتھیوں، ڈرامہ Java کھیل، Dload polyH موسیقی، noline rentl. bx420. IP4. 5we. 150pm
0,مرد ہمیشہ ایک خوبصورت، ذہین، دیکھ بھال، محبت کرنے والے، سایڈست، کوآپریٹو بیوی کی ضرورت ہے. لیکن قانون صرف ایک بیوی کی اجازت دیتا ہے ....
0,یہ بیکار ہے. تو تم اپنے یو ویلنٹائن کے لئے کیا منصوبہ بندی کی گئی ہیں؟ میں نے آپ کے یو ویلنٹائن ہوں نہیں کر رہے ہیں؟
0,3 بجے 63miles - بس حصہ نوٹنگھم ملا. اچھی بات میں نے اتنا میرے آدمی سے محبت کرتا ہوں، لیکن صرف 40mph کر. ارے ہو
0,کیا کوئی شخص واضح طور پر کہہ رہے ہیں سوچنے کے لئے. ٹھیک ہے اس سے کہنے کی کوئی ضرورت چھوڑ دیں. وہ آئے تو مجھے جانا ہے یا نہیں کرے گا
0,ہیلو اچھی صبح .. Thanku U ایک ہی د خواہش ..
0,یو WANT 2 سے ملو UP 2MORRO
0,اصل میں میں تو میں نے ابھی تک نہیں چھوڑا ہے میں بھی بھوکا تھا کا فیصلہ کیا: V
0,میں نے ایک _ میری طرف بھیج دیا ہے ..
0,مجھے jus کے اب ڈیرن WIF شاپنگ باہر تھا ن میں اس سے کہا جاتا ہے کیونکہ 2 وہ ہے Lor وان اور Wat موجود پوچھیں. پھر وہ WIF این انہوں نے آخر میں ڈیرن ہے Lor اندازہ لگایا جو مجھے تھا اندازہ لگانے شروع کر دیا.
1,میں نے کچھ ڈک چاہتے ہیں! میرے شوہر دور ہے، میں ایک حقیقی شخص 2 مجھے مطمئن ضرورت ہے. کوئی ڈور کارروائی کے لئے 89938 کو TXT بیوی. (TXT STOP 2 آخر، TXT REC Ã ¥ Â £ 1.50ea. OTBox 731 LA1 7WS.)
0,سمجھیں. اس کے نقصان میری فائدہ ہے :) لہذا آپ کام کرتے ہیں؟ اسکول؟
0,تم کیسے ہو؟ میں نے یو یاد کیا! مجھے havent ہے 2 چھٹی کے ساتھ بور بہت تھوڑا سا WANT 2 GO باک 2 COLLEGE رہا! SAD اخلاق IT؟ XX
0,ہیا، شاید اگلے بعد گھر * ہفتے کے آخر میں آنے والے
0,اگرچہ میں نے تم سے محبت ہے کہ نہیں بھولنا .... اور میں آپ کے سوا چلنا. تم پر دیکھ اور آپ کے دل گرم رکھنے.
0,میں چیزوں کو مختلف ہوتے. میں کتنا میں نے آپ کی قدر کرتے ہیں کہ آپ کو ظاہر کرنے کے قابل ہو جائے گا جب مجھے حیرت ہے. Pls کی تیز سے Askin مجھ براہ مہربانی بغیر کوئی منشیات چلتا جاری رکھنے اور کے بارے میں ہنسنا چیزوں کو تلاش کریں. میں نے بہت آپ پیار کرتے ہیں.
0,ٹھیک ہے دونوں ہمارے دن. کیا تو آپ رات کے کھانے سے Tonite لئے بنا رہے ہیں؟ سے Am I دعوت دی؟
1,GR8 نئی سروس - آپ کے ہجوم پر براہ راست جنسی ویڈیو چیٹ - 89070 کو بھیجیں STOP منسوخ کرنے کے لئے 89070 کو 4 تفصیلات کے متن سینگ - دیکھیں سیکسی کے dirtiest لڑکیوں الرحمن فون پر رہتے ہیں
0,میرے پاس کوئی پیسہ 4 اسٹیو ساتھی ہے! !
0,IM دیر TELLMISS IM ON MY WAY
0,الرحمن کی زندگی میں ایک دن کبھی دوش. اچھے دنوں یو خوشی دے. برے دنوں یو تجربہ دے. دونوں کی زندگی میں ضروری ہیں! تمام معبودوں کی برکتیں ہیں! صبح بخیر.:
0,عام طور پر میں روزانہ زیادہ پانی پینے کے لیے استعمال کرتے ہیں :)
0,مجھے کہنے کی ہمت ... گاڑی باہر چھںٹائی کے ساتھ کوئی قسمت؟
0,پارٹی یو ایس ایف، کوئی چارج میں میرے گھر میں ہے (لیکن آپ کو کسی بھی طرح سے تعاون کر سکتا ہے تو یہ بہت ہو تعریف کیا جاتا ہے) اور جی ہاں، ہم زیادہ ایک کے لئے کمرے کو مل گیا
0,Urgh میں، کوچ گرم، چپ چربی کی مہک! ایک بار پھر شکریہ، خاص طور پر duvet کے (ایک -امکانات متن لفظ نہیں ہے) کے لئے.
0,ہیا. کل رات کیسی رہی؟ میں شرارتی رہا ہے اور خود کو کپڑے خریدے اور بہت کم ... تیار سے زیادہ کے لئے حالانکہ خریداری کی ہے! آپ کو وقت کی قسم کیا پورا کرنا ہے؟
1,FreeMsg ہیلو بچے واہ صرف ایک نئے کیمرے موبی ملا. چاہتے سی ایک گرم pic کے؟ یا فینسی ایک چیٹ؟ رکھا 4uTxt w8in / rply 82242 HLP 08712317606 Msg150p 2rcv چیٹ
0,میں نے کامیابی کے بغیر اس تک پہنچنے کے لئے کوشش کر رہا ہوں
0,آپ اور طبقے کے ساتھ کیا ڈیریک کب؟
0,کبھی Y لئی ... میں سست بمقابلہ ... ملا اور Wat؟ خزانہ روز ایک _ مجھ دا یو آر ایل کھچڑی کا کام ایک بھیج ...
0,کبھی الرحمن دل سے نکلتی ہے اور الرحمن آنکھیں ذریعے آتا ہے کہ ایک آنسو کے وزن لینے کے لئے اکیلے کی کوشش کریں ... ہمیشہ یاد رکھنا ایک پاگل دوست کے لئے یہاں ہے ... BSLVYL
0,ارے دوست. لاگ لوگوں سے بات کی. WEA ° A A · پر دوبارہ. مہینے کے آخر کی طرف سے فراہم کی ہے. کی 24th ستمبر پر نجات. بعد میں بات کریں.
0,آپ کو ایک اچھا ہفتے اندوز ہو رہے ہیں امید ہے. بس میں جانچ پڑتال
0,ہا ہا، میرے دوست ٹائلر لفظی صرف پوچھا کہ آپ اسے ایک dubsack حاصل کر سکتا ہے تو
0,"\ ارے! یو چا Ã ¥ Ã ہولدار ایک اتارنا Lil مجھ پر مشروبات میں 4 پر مجھ meetin پسند کرتے. TXT یا مجھے انگوٹی اور ہم l8r اپ کو پورا نہیں کر سکتے ہیں تو. کافی تھکے ہوئے ہو گیا 3 v.pist اوپر میں؛) محبت پیٹ ایکس ایکس ایکس \ """""
0,زبردست. ایک محفوظ سفر ہے. سے Dont گھبراہٹ ہتھیار ڈالنے تمام.
0,"\ علامات \ ""جب محبت میں یو ہیں: \"" U آپ کے محبوب 3.U کا نام دیکھ جہاں غصہ نہیں ملے گا جب گانے سننے کی طرح 1.U روکا جائے 2.U آپ کے """
0,سورج آہ ... THK mayb سکتے تو ڈن پر anythin ہیں ... THK کتاب ای سبق کے لئے ہے ... E pilates کی باگ MRT یو نوح ہور میں ہے ...
0,کوئی چیز عزیز کو ایسا کرنے کی کوشش کریں. آپ کے امتحان کے لئے کچھ پڑھ
0,"میری دنیا 7th کے تم پر 6th ؤر سٹائل 5th کے ؤر میں 7 عجائبات مسکرا 4th کے ؤر شخصیت 3rd کی ؤر فطرت کے 2nd ؤر SMS اور 1st \ الرحمن کی دلکش دوستی \ ""... صبح بخیر عزیز"""
0,جہاز معاضہ کو رہا rdy
0,میں نے ہسپتال دا میں ہوں. . میں شام کو گھر واپس آ جائیں گے
0,پیشاب IS بات کر یو احساس ہے کہ اس نقطہ اس میں IT IS کوئی ہے. (اب پیچھے کی طرف اسے پڑھ)
0,+ دا سوچو. تم کرتے جایئں.
0,میں اوہ جاگ رہی ہوں. کیا چل رہا ہے.
0,ہیلو میرے boytoy کے. کس طرح یہاں وہاں دن کہ چلنے جاتا ہے اور؟ آپ کہ پولیس خلاصہ ملی؟ اگر آپ اب بھی باہر اور کے بارے میں ہیں؟ مجھے جاگنا اور اپنی بیب ڈیٹس
0,کتنا یو حاصل کرنے کی کوشش؟
0,کے ارد گرد کریں & lt آو؛ اعشاریہ & gt؛ پر بجے vikky..i'm otside NW، IL THT وقت کی طرف سے آنے
0,مجھے بتائیں کہ آپ کے ایڈریس بار پھر کیا ہے
0,شہد کی مکھی نے کہا: میں د ورلڈ * خدا ہنستے تھے اور AMP میں سب سے پیاری د ہوں *؛ نے کہا: انتظار، یو Havnt موسمیات D شخص پڑھنا یہ پیغام رسانی * اخلاقی: یہاں تک کہ خدا سکتے کریک لطیفے! GM + GN + GE + GN :)
0,میں نے اسے ایک بلیک بیری بولڈ 2 یا مشعل خریدنے چاہئے. میں اسے نئے یا استعمال کیا خریدنے چاہئے. مجھے بتاءو. پلس آپ کہہ رہے ہیں کہ میں خریدنے کریں & lt چاہئے؛ # & gt؛ پر G وائی فائی رکن. اور تم کریں & lt کے بارے میں کیا کہہ رہے ہیں؛ # & gt؛ پر جی؟
0,لیکن اگر آپ ایک ساتھ تھے تم اس کے بارے سوچ ہونا چاہئے تاکہ
0,ہیا جو دھوپ افریقہ میں جا نسل؟ یو ایک اچھا وقت AVIN دیگر ر امید ہے. مجھ سے کہا کہ بڑی عمر میں چاندی واپس ایک بڑا بوسہ دے.
0,کس وقت کرنی کل آنا
1,چاہتے ہنسی ہے؟ اب آپ کے موبائل پر چٹ چیٹ کی کوشش کریں! لاگ آن لفظ txting طرف: چیٹ اور کوئی پر بھیج: 8883 CM PO باکس 4217 لندن W1A 6ZF 16+ 118p پر کود / MSG rcvd
0,\ چا QUITEAMUZING یہی â ¥ Ã SCOOL بیب
0,OMG یو کیسے پتہ چلا کہ میں کیا کھایا؟
1,"\ فوری! یہ جیت ¥ Â £ 1000CALL 09071512432 B4 300603t & csBCM4235WC1N3XX.callcost150ppmmobilesvary ہے کانٹیکٹ یو! U کرنے کے 2nd کی کوشش ہے. MAXA ¥ Â £ 7. 50 \ """""
0,:( لیکن آپ یہاں نہیں ....
0,براہ راست پیچھے نہیں ... ABT 4 لائنیں ایک کے پیچھے _...
1,مبارک الرحمن نوازا CD واؤچر کے 500 یا 125gift ضمانت اور مفت انٹری 2 100 wkly 87066 کو TXT MUSIC اپنی طرف متوجہ
1,آپ کے معاہدہ موبائل 11 Mnths تھا؟ تازہ ترین Motorola ڈاؤن، Sony Ericsson ڈاؤن وغیرہ سب مفت! ڈبل منٹس & اورنج ٹیرف پر متن. کال بیک کے لئے متن جی ہاں، کوئی ریکارڈ سے دور کرنے
1,ارجنٹ! آپ کے لینڈ لائن سے 09066350750 پر کال کریں. آپ کا اعزازی 4 * Ibiza میں چھٹیوں یا 10،000 نقد انتظار مجموعہ SAE T & کاوچ سرفنگ PO BOX 434 SK3 8WP 150 پیپییم 18+
0,ابھی تک کوئی ارادہ. تم کیا کر رہے ہو ؟
0,ہیلو .... میری مصروفیت کریں & lt پر fixd گیا ہے؛ # & gt؛ پر اگلے ماہ کے ویں. میں نے اس کی بہت ہی افسوسناک BT .... ہمم سے Njan vilikkam .... T ایک sudn ؛-( کے امام WS جانتے ہیں.
0,نہیں بالکل. صرف ایک ماہ میں ہم نے ختم کر سکتے ہیں کے ساتھ ایک دن ایک باب ریاضی.
0,واہ نہ یہ کہ ایک عام بات تھی سوچا. میں نے وہ سب پیٹھ الرحمن نہ ایک بیکار لے! U اسے کاٹ جب تک :-)
1,80878. ٹی اینڈ سی کی www.txt-2-shop.com custcare 08715705022، 1x150p / فی ہفتہ کرنے کی دکان: ایک ¥ Â £ 250 wkly خریداری اتسو مناینگی TXT جیتنا الرحمن موقع کے لئے
0,Noooooooo کریں. آخری بات یہ ہے کہ مجھے ضرورت پر زور ہے. آپ کی زندگی میں ایک بار کے لئے منصفانہ ہو.
1,U تلاش کر رہی ہے جو انڈر مل وہ کون R * پر UR کیا خاص کال سوچتا ہے کہ جو ظاہر باہر 09065171142-stopsms-08718727870150ppm ساتھ 2 سے رابطہ ایک خفیہ مداح ہے
1,Mila کی، age23، سنہرے بالوں والی، برطانیہ میں نئے. میں برطانیہ لڑکوں کے ساتھ جنسی نظر آتے ہیں. U میرے ساتھ مذاق پسند ہے. 69866،18 کو لکھ کر MTALK. 30pp / TXT 1st کی 5free. Ã ¥ Â £ 1.50 دھیرے بڑھتا. Help08718728876
0,میں دیکھتی ہوں تو مجھے تھوڑا سا میں کی طرف سوئنگ کر سکتے ہیں، firsg یہاں کا خیال رکھنا کچھ چیزیں مل گیا
0,میں نے ایک خوش نئے سال کی مبارک چاہتے تھے اور میں نے جب گیری اور میں تقسیم کے ساتھ لیکن ذاتی طور پر ایسا کرنے کی کچھ قانونی مشورہ کے بارے میں آپ سے بات کرنا چاہتے تھے. میں نے اس کے لئے Ptbo کے دورے کر دے دیں گے. مجھے امید ہے کہ آپ کو لڑکی اور میں یا محبت کے ساتھ سب کچھ اچھا ہے :)
0,آپ کا کام ابھی تک یا کچھ ختم نہیں کیا ہے؟
0,کل میں تھیٹر کے لئے نہیں جا رہا ہوں. . . تو میرے آنے U مجھے فون جہاں کہیں بھی کر سکتے ہیں. . . مجھے بتائیں کہ کہاں اور کب کل آنا
1,ویسے انگلینڈ نے کیا! سے Yer موبائل پر سرکاری پولی، کثیر رنگ ٹون یا رنگ کے پرچم حاصل کریں! 84199 اب متن کے سر یا پرچم! آپٹ آؤٹ ENG STOP TXT. Box39822 W111WX Ã ¥ Â £ 1.50
0,اسے درست فون کیا جو اسے تمہاری طرح ایک بڑی تعداد کے ساتھ کسی کو تھا اگر آپ نہیں تھا!
0,اس میں غصہ ب سے Wun ٹھیک ہے. MSG یو پچھاڑی میں گھر آج رات آئے.
0,میں بھی ایک اچھا وقت تھا. اس کا اچھا کچھ تبدیلی کے لئے میری اختتام ہفتہ کے ساتھ تھوڑا سا مختلف کرنا. پھر ملیں گے
0,معذرت یو شاور سڑکنا میں تھا
0,کارلوس نیچے ہے لیکن میں نے اسے تو میں تھوڑا سا میں یو ایس ایف کی طرف سوئنگ گے، اس سے لینے ہیں
0,مکمل گرمی PA :-) میں تیل PA applyed ہیں.
0,میں نے دا لیفٹیننٹ کے دا دائیں ہاتھ کی طرف دا قطار کے دا وسط میں پھنس رہا ہوں ...
0,آپ کو آپ کے یئرٹیل لائن کی تدفین کر دی گئی ہے؟
0,ہیلو بیمار PROB jus کے اسے ایک واؤچر FRM کنواری یا sumfing حاصل نہیں ہے تو یو WOT 2 حاصل 4 ان سالگرہ کا فیصلہ کیا تھا
1,FreeMsg: TXT: نہیں پر کال کریں: 86888 & دعوی ہے 3 گھنٹے کی آپ کے اجر کو اب آپ کے فون سے استعمال کرنے کا وقت بات کریں! Subscribe6GBP / mnth انکا 3hrs 16 روکیں؟ txtStop
0,\ ارے J! آر یو کو کسی بھی بہتر محسوس
0,اور میں رات رہنے پر ارادہ نہیں ہے لیکن میں prolly دیر تل واپس نہیں ہو گا
0,ON ME شکریہ 4 سے puttin DA fone جانا DOWN !!
0,میں نے ایک 8th کی ضرورت ہے لیکن میں اے ٹی ایم کیمپس بند ہوں، میں ایک یا دو گھنٹے میں اٹھا سکتا ہے؟
0,چلا گیا اوہ ... ہا ہا ... ڈین ہم نے shld آج بھی ... جی، nvm لا ... Kaiez، میں ڈن ذہن جاز جا OSO ... کو کھولنے نہیں کر سکتے کیچ ہپ ہوپ ڈر ...
0,چل رہا ہے لیکن صرف 5 منٹ کے لئے منظم اور پھر آکسیجن کی ضرورت ہے! رولر آپشن کا سہارا ہے ہو سکتا ہے!
0,ہم اگلے کریں & lt میں رہتے؛ # & gt؛ پر منٹ
0,Y ڈی اس طرح پوچھ.
0,بس خوشی ہے کہ آپ سے بات کر جائے.
0,اور Wat بار ایک _ ختم؟
0,معذرت دا. بہت سے زیر التوا کام کیا کرنا ہے تو میں چلا پاگل.
0,تم کتنا صفائی ستھرائی کے لئے مل گیا
0,میرا پسندیدہ شخص آج نسل؟ آر یو مشکل کام کر؟ نہ نیند دوبارہ گزشتہ Nite میں تقریبا 4.30 پر یو بجی سکا
1,سنشائن کوئز! آپ آسٹریلیا کے دارالحکومت canname اگر ایک سپر سونی ڈی وی ڈی ریکارڈر جیتنے؟ 82277. بی کو MQUIZ متن
0,ایک والد oredi نامی ...
0,اچھی. کیا آپ مجھے کچھ PIX بھیج سکتا سوچتے ہیں؟ میں نے آپ کے اوپر اور نیچے دیکھنا پسند کروں گا ...
0,Nvm ... میں نے ویسے بھی میری کھیل کے جوتے پہننے کے لئے جا رہا ہوں ... مجھے دیر لہ ہونے کے لئے جا رہا ہوں.
0,معذرت، میں نے اجلاس میں بعد میں فون کرتا ہوں.
0,یہ ایک طویل fuckin کے SHOWR IS
0,موصولہ، (ن) ان پر کارروائی سمجھ گیا!
0,انہوں نے آخر چھت ٹھیک کرنے کے لئے آئے تھے.
0,"یو میری presnts ہمیشہ bcz یو کھچڑی غلط محبت کی ضرورت ہے. \ jeevithathile irulinae neekunna prakasamanu Sneham میں \ ""پرکاشم ennal پربا 'وہ ایم این ایس پربا is'LOVE' سمجھے. شرمندہ غلط مجھے ...."""
0,jus کے ختم میرے بال اڑانے. یو ختم ڈنر کے پاس پہلے سے ہی؟
0,مجھے بس پر ہوں. تم سے محبت ہے
0,LOL ... مجھے پتہ تھا کہ .... میں ڈالر کی دکان میں دیکھا
1,تم جیت ایک بات کی ضمانت ایک ¥ Â £ 1000 نقد یا ایک ¥ Â £ 5000 انعام کے طور پر 10 am-9pm درمیان 0800 169 6031 پر ہمارے کسٹمر سروس کے نمائندے کال کریں!
1,آج سے Voda اعداد 7634 کے ساتھ ختم ایک ¥ Â £ 350 اجر حاصل کرنے کے لئے منتخب کر رہے ہیں. آپ کو ایک میچ ہیں، تو دعوی کوڈ 7684 معیاری شرحوں کا اطلاق کے حوالے سے 08712300220 پر کال کریں.
0,صرف ہفتہ اور اتوار کی چھٹی اس کے بہت مشکل :) اتنا
0,ہر کوئی اس شام مزہ تھا. مس آپ.
0,سے Hella گیس پیسہ ہے، تھوڑا سا میں گیلیلیو کے ساتھ ایک عظیم الشان فطرت جرات پر جانے کے لئے چاہتے ہیں؟
0,میں ایک میٹنگ میں ہوں، میں بعد میں مجھے فون
0,اوہ thats کے ہم جنس پرستوں واہ. اپ ڈیٹ کی مدد کی فرم ویئر گا
0,یہ نہیں چلے گا. مارفین پر منتقل کرنے کے لئے ہے
0,کس طرح میں نے الدین C ایک _... جی ہاں میں نے اپنے بال کاٹ آئے ...
0,K K PA اپنا کھانا آہا تھا.
0,اوہ ہو. یہ پہلی بار یو الفاظ کے ان کی قسم کے لئے استعمال ہے
0,کیپٹن vijaykanth کپتان میں tv..he ہے شرابی :) کامیڈی کر رہا ہے
0,بلکل. میں نے خدا کو صرف اسی وقت ہولڈ پر مجھے مل گیا ہے لگتا ہے.
0,آپ anythiing یا مجھ سے فاصلہ رکھتے ہوئے چھپاتے ہو
0,havent ہے.
1,آپ کو فٹ کیا جا رہا ہے! www.clubmoby.com سے اپنے موبائل مضمون حاصل کریں صرف 3 کے لئے چھ ڈاؤن لوڈز کو فون 08717509990 متعدد / سچ / PIX / رنگ ٹونز / گیمز
0,معذرت میں نے اپنے پیڈ کو مقفل الدین.
0,U کہ افراد کہانی ملا دیا
0,آپ چنئی آنے کی منصوبہ بندی کر رہے ہیں؟
1,ہم رابطہ کرنے کی کوشش کسی بھی نیٹ ورک منٹ نصف قیمت لائین رینٹل کی خدمات Camcorder کے جواب یا 08000930705 پر کال کریں اگر آپ کو ایک ویڈیو فون 750 کسی بھی وقت کی ہماری پیشکش کو آپ کے جواب کا دوبارہ
0,خدا الرحمن ہاتھ پکڑ کر اتنا DAT sum1 vry خاص ان لوگوں کے فرق کو بھرنے گا الرحمن انگلیاں btwn خلاء پیدا ... ابھی تو plz پوچھیں کہ نہ Y وہ ٹانگوں کے درمیان اتنا فرق پیدا !!!
0,ہم ٹھیک ہیں. اب سونے جا. بعد میں دیکھیں
0,ای خطرات سے خود کو محفوظ کریں. SIB کبھی نہیں پاسورڈس، ATM / SMS PIN ای میل کے ذریعے جیسے حساس معلومات کے لئے پوچھتا ہے. کسی کے ساتھ اپنا پاس ورڈ اشتراک کبھی نہیں.
0,"آخر یہ کیا ہو گیا ہے ..! عشروں Aftr ..! BEER اب پٹرول کے مقابلے میں سستا ہے! حکومت ہمیں \ DRINK \ کرنے کی توقع رکھتا "". لیکن ایسا نہیں \"" ڈرائیو \ """""
1,ایک ¥ Â £ 400 کرسمس اجر آپ کے لئے انتظار کر رہا ہے! ہمارے کمپیوٹر تصادفی ایک ¥ Â £ 400 اجر حاصل کرنے کے لئے ہماری وفادار موبائل صارفین کی طرف سے آپ کو اٹھایا گیا ہے. بس 09066380611 پر کال کریں
0,کہاں آر ای کے اجلاس TMR؟
0,LOL ہاں. لیکن یہ آپ کے دن کے لئے کچھ مسالا شامل ہوں گے.
0,آپ ایک عظیم دن اندوز ہو رہے ہیں امید ہے.
0,ہمارا Prasanth ettans والدہ گزشتہ رات انتقال. بس اس کی اور خاندان کے لئے دعا کریں.
0,K، میں نے کچھ باہر کام کریں گے
1,نجی! شوز 800 غیر چھڑا ایس I. M. پوائنٹس کے لئے اپنے 2003 اکاؤنٹ اسٹیٹمنٹ. کال کریں 08718738002 شناخت کا کوڈ: 48922 21/11/04 ختم ہوجاتا ہے
0,1) appy حال سیٹی نہ پیں: یہ پیغام بھارت میں ایک عظیم ڈاکٹر :-) سے ہے. یہ کینسر کا باعث بن عمر پر مشتمل
0,میں ابھی فون اٹھا سکتے. Pls ہمیں ایک پیغام بھیجیں
0,تم اسے فون کیا اور اب ان کے سامنے بتائیں. اب اسے بلاو.
0,ٹھیک ہے کوئی PROB ...
0,پہلی خواتین و جینس دوسری K.
0,جی ہاں جی نہیں براہ مہربانی. تیراکی گیا؟
0,ماں نے پہلے ہی رابنسن نہیں جا رہا.
0,ٹھیک ہے سیٹ یو نوح ای نے بعد میں تفصیلات بتائیں ...
0,Not..tel سافٹ ویئر کا نام ..
0,میں پرنٹ آؤٹ دا بھیجیں.
0,IM واقعی سوج IMAT MY ماؤں سے 2nite WHAT 2MORO بارے
0,"میں پیدا ہوا تھا جب، خدا نے کہا، \ ارے نہیں! ایک اور بیوکوف \ ""میں آپ پیدا ہوئے تھے جب"
0,میں نے اسے دوبارہ بھیجیں، الرحمن مکمل msg..sometext غائب ہے حاصل نہیں کیا
0,شاید نہیں، میں نے تقریبا گیس سے باہر ہوں اور میں نے کل سے کچھ نقد رقم حاصل
1,کسٹمر سروس کا اعلان. ہم نے حال ہی تم سے ایک کی ترسیل کے بنانے کی کوشش کی ہے لیکن ایسا کرنے کے لئے ایسا ہے، تو دوبارہ شیڈول کرنے 07099833605 پر کال کریں قاصر تھے. ریفری: 9280114
