spam/ham,message
0,ٹھیک ہے، کہا جاتا ہے ماں کی بجائے مذاق ہے
1,محترم واؤچر حاملین، اس ہفتے آپ کے کمپیوٹر پر پیش کرتے ہیں، براہ مہربانی http://www.wtlp.co.uk/text پر جانے کا دعوی کرنے کے لئے. ٹی ایس اور کاوچ سرفنگ کے لاگو ہوتے ہیں.
0,مجھے یقین ہے کہ بیتاب ہوں ویسے تو میں نے ابھی ایک بار پھر آرمنڈ بلاتا ہوں
0,آپ ابھی کام پر ہیں؟
1,مبارک ہو! نوکیا 3650 ویڈیو کیمرے فون 150ppm یوینیو کال 3mins موبائلوں 16+ بند 300603 پیغام کی BCM4284 LDN WC1N3XX سے مختلف ہوتی ہیں آپ کی کال 09066382422 کال کی لاگت ہے
0,کچھ بھی نہیں سنا ہے اور میں وہ flaked اندازہ لگا رہا ہوں تو وہ میری نصوص کا جواب نہیں دے رہا ہے. یہ JB اچھا ہے کہا
0,Mmmmmm ... مجھے تم سے محبت، اتنا، احمد ... میں نے اس سال کے لئے انتظار نہیں کر سکتے ہیں کے طور پر ہر دوسرے آپ کی طرف ہونے کے قریب لے جاتا ہے شروع کرنے کے لئے. نیا سال مبارک ہو، میری جان !!
0,Pls ہمیں مذاق کے اسکول فلوریڈا یونیورسٹی میں فیس ک کا پورا نام اصل میں ہونا کریں & lt کرنے لگتے ہیں ہے؛ # & gt؛ پر K. Pls ہم سے Holla واپس
0,معذرت، میں بعد میں فون کرتا ہوں
0,ٹھیک ہے ... لیکن وہ مجھے حکمت دانت اندر 2 ن mayb ضرورت کو دور چھپے مل گیا ہے نے کہا.
0,اور pls pls کی کافی مقدار کافی مقدار پانی پینا
0,آپ کیسے ہیں. ملکہ طریقہ یہ ہے. آپ کو شاہی شادی کے لئے جا رہے ہیں
0,انہوں نے کہا کہ وقفہ میں ہے. یہ صرف دکھ کی بات حصہ ہے لیکن ہم اسکائپ کے لئے رابطے کا شکریہ میں رکھنا
0,ٹھیک ہے Lor پھر ہم چلے ٹرین ہے Lor ...
0,کچھ کھلاڑیوں کے لئے انتظار کر دو ٹیموں
0,ایک سکتے _ مجھ دا رپورٹ کی ایک کاپی بھیج؟
0,swhrt کہ کس طرح U، Dey میں یو 2day.love بارے ن miss.take نگہداشت الرحمن ٹھیک ہے، TOT امید ہے.
0,ٹھیک ہے جی ہاں، میں نے پہلے ہی منصوبہ بندی کی. میں تمہیں لینے جایئں.
1,ارجنٹ! کال کریں 0906346330. آپ ABTA اعزازی 4 * ہسپانوی تعطیل یا ایک ¥ Â £ 10،000 نقد انتظار مجموعہ SAE T & کاوچ سرفنگ BOX 47 PO19 2EZ 150ppm 18+
0,معذرت، میں نے اجلاس میں بعد میں فون کرتا ہوں
0,میں صرف واقعی کل سے پہلے گندگی ضرورت ہے اور میں تم جاگ نہیں ہو گا جانتے ہیں 6 کی طرح اس سے پہلے
0,میں ٹھیک ہوں. آپ کا ووٹ کو رجسٹر کیا ہے؟
0,ٹھیک ہمم، میں نے اپنی آنکھ واقعی زخم ہے کیونکہ ایک گھنٹے کی طرح کے لئے رہیں گے!
0,محترم کالیکٹ سے براہ راست بس مل گئی
0,مم اس سے کہو بعد میں ایک دوسرے کے ساتھ ادا کر سکتے ہیں آنے کے لئے بھی سے Vava پوچھنا مسلمہ
0,ویسے عام قیمت ہے کریں & lt؛ # & gt؛ پر / آانس، مجھے بتائیں جب / آپ کتنا چاہتے ہیں تو /
0,معذرت، میں بعد میں فون کرتا ہوں
0,ایک دن میں ہر لمحے اس کی اپنی ویلیو صبح امید لاتا ہے، دوپہر کے ایمان لاتا ہے، شام میں Luv لاتا ہے، رات باقی لاتا ہے، یو ان تمام today.Good مارننگ
0,کریں & lt؛ # & gt؛ پر ڈبلیو jetton یوینیو اگر تم بھول گئے
0,ٹھیک ہے اب میں گھر آ رہا ہوں.
0,اس ملک میں غیر ملکی ٹکٹوں کا استعمال نہیں کر سکتے.
1,ڈبل منٹ اور txts 4 6months مفت بلوٹوت اورنج پر. سونی پر دستیاب، Nokia موبائل Motorola ڈاؤن فونز. 08000839402 پر کال MobileUpd8 یا call2optout / N9DX
0,معذرت، اس کا دوست-کا-ایک-دوست چیزیں ایک بہت میں خریدنے کے لئے چاہتا ہے جو اصل آدمی سے بات کرنے کے بارے میں اب صرف رہا ہوں،
1,1st کی ہفتے کے لئے مفت! No1 کی نوکیا کو صرف NOKIA TXT 8007 کے لئے حاصل txting اور بتا الرحمن ساتھیوں www.getzed.co.uk پی.و. 36504 W45WQ norm150p / سر 16+ سر 4 الرحمن ہجوم ہر ہفتے
1,جواب TONES2U 2 اس متن ایک ہفتہ وار نئے سر کے ساتھ الرحمن fone جانا اپ فنک کرنا چاہتے ہیں. www.ringtones.co.uk، اصل N بہترین. ٹونز 3GBP نیٹ ورک آپریٹر کی شرح کا اطلاق
1,سے Cmon بیب، مجھے سینگ بنانے، * پر باری * مجھے! ) براہ گرم، چپچپا اور اب آپ کی ضرورت - مجھے آپ کی کلپنا اب لڑکی TXT. تمام جوابات Ã ¥ Â £ 1.50 لاگت آئے گی. 2 بھیجنے STOP منسوخ
0,مجھے کل دی آئیں گے
0,Wylie اپ ڈیٹ: میرے گھاس ڈیلر کارلوس آزادی کے پاس گیا اور lunsford ساتھ ایک کلاس تھا
0,تم خوش بچے ہیں؟ کیا آپ ٹھیک ہیں ؟ آپ اس کام کے لے گئے؟ میں نے آپ کے تعاون کا شکریہ. میں نے آپ کو آپ سمندر ... * بوسہ * * بوسہ بھر سے مسکرا بنانے کے لئے ایک چوببن بھیج *
0,سی فلم آخری منٹ کے فیصلے ایم اے پاروں ہے. پاروں 2 لار لیکن میں دیکھنے _ دلچسپی نہیں TOT.
0,آپ کو اس سمسٹر کے لئے کس طرح لطف لے رہے ہیں؟ دیکھ بھال کے بھائی کو لے لو.
1,اہم معلومات 4 ورینج USER 0796XXXXXX. آج UR خوش قسمت دن! 2 تلاش باہر کیوں LOG IS http://www.urawinner.com پر ایک تصوراتی، بہترین PRIZEAWAITING YOU نہیں ہے!
0,دروازہ ہو جاؤ، میں یہاں ہوں
0,اگلے ہفتے اس کا استعمال، شہزادی کی اجازت دیتا ہے :)
0,یا میں نے پہلی لار ایک گھر جانا _ 4 مجھے انتظار ہے Lor .. میں پہلے میرا سامان نیچے رکھ ..
0,میں نے اس کے منگل KFC چاہتے ہیں. صرف 2 کھانے ONLY 2. کوئی گریوی خریدنے. صرف 2 مارک. 2!
0,کوئی دا:) وہ اس طرح بھیجنا بیوکوف da..always ہے:) ڈان ایمان والوں message.pandy میں سے کسی ایک ذہنی :) ہے
0,اوئی آپ جب انگوٹی والا
1,چھوٹی ہوئی کال الرٹ. یہ اعداد کہا جاتا ہے لیکن کوئی پیغام چھوڑ دیا. 07008009200
0,میں شرکت کی لیکن کچھ بھی نہیں ہے.
0,DAT ہے Lor طرح 530 اے آر ڈی. پھر MRT اسٹیشن میں ہم پاروں ملو _ ڈن باہر آنے کے لئے مصحف.
0,نہیں بیٹا میں نے :-P سو رہا تھا
0,یر میگاواٹ بھرا IM tuth aight ہے
0,4 بجے دفتر ہو جائے گا. ابھی میں ہسپتال جا رہا ہوں.
0,وہ اشتھار لگانے شروع دراصل میں نے 2 ہفتوں کے لئے انتظار کر رہا ہوں.
0,کچھ بھی ہے Lor وہ سب تو جاؤ تو میں ہے Lor جانے ...
0,یو ہفتہ رسم پر آزاد؟ U مجھے ن ڈیرن ن mayb XY WIF 2 گھڑی راکشسی امور وان؟
0,Plz کی نوٹ: اگر ایک موبائل کمپنی اور AMP سے بلا کسی؛ # & gt؛ پر یو # کریں & lt ٹائپ کرنے کی پوچھتا ہے؛ یا # کریں & lt؛ # & gt؛ پر . ایسا نہ کریں. ، کال منقطع جو کوئی SIM کارڈ کے استعمال بنانے کے لئے 'دہشت گرد' کی ایک کوشش iz میں coz کہ. سے Itz نوکیا این Motorola ڈاؤن طرف confirmd این CNN IBN کی طرف سے تصدیق کی گئی ہے.
0,یو آپ کے ارد گرد؟ میرے ایک دوست نے آج رات کو بعد لینے کے لئے لگ رہا ہے
0,اپنے فون پر صحیح پاگل آٹو
0,ڈبل بیدخلی اس ہفتے - سرپل اور مائیکل اور ان سے اچھی riddance!
0,"\ دنیا نہیں کیونکہ برے لوگوں کے تشدد کی ایک بہت دوچار ہے .... لیکن کیونکہ اچھے لوگوں کی خاموشی اختیار کی! \ """
0,ٹھیک ہے thats کے ٹھنڈا. اس کا ہے، صرف یا تو Raglan کو آرڈی یا ایڈورڈ RD بند. پیچھے کرکٹ گراؤنڈ. مجھے دو کی انگوٹی جب الرحمن closeby آپ کو دیکھ منگل.
0,میرے لئے ابھی ایک انڈے da..please :)
0,آپ Skye کے میں شروع کر دیا ہے
0,آپ bookedthe جھونپڑی ہے؟ اور یہ بھی اپنے وقت سے دور؟ تمہیں کیسے راہ کی طرف سے ہیں؟
0,اور تم صاحب کو کئی.
0,U واقعی سور لہ نیند بہت بہت. میرے والد 10 smth پر مجھے جاگنا 2 آج دوپہر کے کھانے کھاتے ہیں.
0,میں گھر پر ہوں. کال کریں
0,میری محبت ... میں نے آپ کو کچھ بھی سخت کر نہیں امید ہے. آپ کو آپ کے پی سی یا آپ کے فون کو فروخت کی ہمت نہیں ہے ...
0,اب صرف میں گھر پہنچ گئے. . . اب میں بہت تھکا ہوا ہوں. . مجھے tomorro آئے گا
1,FREEMSG: ہمارے ریکارڈز بتاتے ہیں کہ آپ حادثے تمہارے پاس تھا کے لئے 3750 پونڈ کے مستحق ہوسکتے ہیں. کے لئے اس MSG کرنے YES ساتھ مفت کے جواب کا دعوی کرنے کے لئے. متن STOP آپٹ آؤٹ کرنے کیلئے
1,یو جیت ¥ ایک موسیقی گفٹ واؤچر کے 100 £ ہر ہفتے NOW TXT شروع ہونے والے 87066 TsCs www.Idew.com SkillGame، 1Winaweek، age16 لفظ متوجہ کر سکتے ہیں. 150ppermessSubscription
0,لائف سٹائل گارمنٹس براہ مہربانی کوئی اکاؤنٹ.
0,LOL WTF بے ترتیب. BTW ہے کہ آپ کے کھانے کے وقفے
0,ایسئجیڈ، U & عرب لڑکے ڈی نسل؟ یو تمام اچھے یا eshxxxxxxxxxxx میری محبت 2 evry1 محبت دے ر امید
0,عام آدمی! بس آپ کو معلوم ہے کہ آپ کو یاد کیا اور بند سوچا کر رہے ہیں کی اجازت دینا. ایک عظیم دن ہے. اور تم کو بھیج سکتے ہیں تو مجھ سے Bimbo کی اور Ugo کی کی تعداد، بیمار تعریف کرتے ہیں. محفوظ
0,ڈیٹرائٹ. برف کا گھر. اس کا لطف لو.
1,الرحمن رنگ دکھائیں! یورو 2004 2-4-1 پیشکش! الرحمن فون پر ایک انگلینڈ پرچم & 3Lions سر ہو جاؤ! معلومات کے لئے مندرجہ ذیل کی خدمت پیغام پر کلک کریں!
0,Okie ...
0,تاکہ آپ کے راستے پر ہیں جب متن مجھ Aight، میں نے ایک دوست کے کمرے میں میں chillin ہوں
0,توشیبا Portege M100 GD ہے؟
0,ویسے welp ایک semiobscure انٹرنیٹ چیز کی طرح ہے
1,69669 کے لئے متن PASS آپ کثیر صوتی رنگ ٹونز جمع کرنے. عمومی GPRS چارجز صرف لاگو ہوتے ہیں. آپ کے ٹن کا لطف اٹھائیں
1,اسی کے مطابق. میں دوبارہ، صرف آپ کے موبائل فون اور بھیجنے پر لفظ ٹھیک متن
0,سے Loosu ہسپتال لے جاؤ. ڈی سے Dont جو لاپرواہ دو.
0,ایک آٹھویں کے لئے کتنا؟
0,OMG جواننا مجھے پاگل کر رہی ہے. وہ میری تصاویر تلاش کرنے کے لئے اپنے تمام دوستوں کے ذریعے دیکھا گیا ہے. اور پھر وہ مجھے نہ بھی ایک سال کی طرح میں پر لاگ ان کیا ہے جو میرے مااسپیس پر چیزوں کے بارے میں پوچھ رہا ہے. : /
0,میں تل U الرحمن جیون ساتھی کا نام لونگا، مہینے اور سال کے ساتھ الرحمن پیدائش ارسال کریں. اور حساب کتاب کے طریقہ. ضروری نہیں ہیں.
0,پاروں اب havent ہے تھوڑا سا کلنک کلنک ... کر سکتے ہیں تو اٹھی؟ والد لیاو باہر گیا ... میں OSO اب کم نہیں کر سکتے ...
0,کس طرح کے کپڑے، زیورات، اور دوروں کے بارے میں؟
1,بلاک توڑنے والا اب نئی خصوصیات اور T- موبائل سے عظیم گرافکس کے ساتھ ڈیلکس کی شکل میں آتا ہے. کے لئے ابھی صرف ایک ¥ Â £ 5 حاصل BBDELUXE جواب دے کر اور چیلنج لے
0,آہ! سینے سے لگانا سرسبز ہو جائے گا! میں مہارت Fumbling کے کسی بھی قسم سے پہلے چائے اور سوپ کے بہت سے کی ضرورت چاہتے ہیں!
1,اہم معلومات 4 اورنج صارف. آج آپ خوش قسمت دن ہے! http://www.urawinner.com پر لاگ وہاں کیوں ایک تصوراتی، بہترین اچانک آپ کا انتظار کر باہر 2find!
0,مجھے دیر ہو گئی. میں وہاں ہو جائے گا
0,ایک شخص کے دکھ کی کہانی - گزشتہ ہفتے میرے b'day تھا. میری بیوی نے مجھے خواہش did'nt. میرے والدین ن تا بھول گیا میرے بچے نے کیا. مجھے کام کے لئے گئے تھے. یہاں تک کہ اپنے ساتھیوں کی خواہش نہیں کی.
0,آپ کو پتھر میں آپ کے خاندان کے سیٹ کے ساتھ منصوبہ بنا رہی ہیں؟
0,Pls اگر مطالعہ بھول نہ
0,آپ اس پر یقین نہیں کروں گا لیکن میں واقعی میں ٹاؤنٹن میں اتر گئی ہیں. زبردست
0,ڈین صرف ہفتے کے دن خصوصی قیمت مل گیا ... Haiz ... کھچڑی لیاو کھانے ... کٹ ناخن رٹنا انتظار OSO میں اور Wat سے Drivin ختم ہونے تک، دوپہر کا کھانا اب بھی اور Wat کھا رٹنا ...
0,وہ صرف کوئی شہر میں کیوں وجوہات میں سے ایک فہرست ٹوٹ گیا اور وہ وینگیپورن یا صرف faggy بن رہا ہے تو میں نہیں بتا سکتا
0,کریں & lt؛ اعشاریہ & gt؛ پر M لیکن اس کی نہیں ایک عام گاڑی یہاں تو اس کی بہتر چین یا ایشیا سے خریدنے کے لئے. یا میں نے یہ کم مہنگا مل جائے. I.ll سے Holla
0,زمین پر جرأت کے عظیم ترین ٹیسٹ دل کھونے کے بغیر ریچھ کو شکست دینا ہے .... GN TC
0,SORRY IM STIL گڑبڑ LAST Nite کی بعد کم 430 کیا گیا ہے 4 630 میں کام TOBED چلا گیا
0,ارے اتنی منصوبہ بندی اس بیٹھا کیا؟
0,خوبصورتی نیند بھی الرحمن پھوڑنا مدد کر سکتے ہیں.
0,زبردست. آپ کو بھی موڈ مردوں سے آپ کے کنکشن استعمال کر رہے ہیں کیونکہ آپ کو معلوم ہے کبھی نہیں کر سکتے ہیں پرانے دوستوں آج آپ کی قیادت کر سکتے ہیں یہی امید
1,Natalja (25 / F) آپ اس کے دوست بننے کے لئے مدعو کر رہا ہے. www.SMS.ac/u/nat27081980 STOP: YES-440 یا کوئی 440 دیکھتے اس کے جواب؟ 62468 کو STOP FRND ارسال کریں
0,ان لوگوں کو کہاں سے حاصل کرنے کے لئے؟
0,طرح کا. بس آدھا گھنٹہ میں دمہ کے حملے، NXT ایک کی ٹرین کیونکہ یاد میں ڈرائیونگ تاکہ اس بات کو یقینی جہاں پارک کرنے کے لئے نہیں.
0,گیند گزشتہ میں ایک lot.will سپن آگے بڑھ رہا ہے:) بیٹنگ کرنے تاکہ بہت مشکل :)
0,Haiyoh ... شاید آپ میں Hamster لاکھ سے جلتا تھا
0,آپ مجھے میری چاچی اور نمبر بھیجیں کر سکتے ہیں
0,میں خوش ہوں. آپ اپنے خوابوں کی پیروی کر رہے.
0,میں آخر میں گھر پہنچ گئے ...
1,URGENT. 02 صارف کے لئے اہم معلومات. آج آپ خوش قسمت دن ہے! کیوں، http://www.urawinner.com پر لاگ ایک کمال حیرت آپ کا انتظار کر رہا ہے 2 یہ معلوم!
1,فاتح !! ایک قابل قدر نیٹ ورک کسٹمر کے طور پر آپ receivea Ã ¥ Â £ 900 انعام اجر کو منتخب کیا گیا ہے! کال 09061701461. دعوی کوڈ KL341 کا دعوی کرنے کے لئے. درست 12 گھنٹے صرف.
0,WN یو آر قریب ہے جو 2 یو ڈی prsn، کی طرف سے چوٹ عقل سے Dem خلاف جنگ کرتے ہیں. coz کہ مسترد جنگ ایک سلسلے میں کچھ پرسکون پتیوں ہونے BT رشتہ بچاتا somtimes .. سے Gud eveB-)
0,یو اب کال کر سکتے ہیں ...
0,سائنس ہے کہ چاکلیٹ سورج کی روشنی کے تحت پگھل جائے گا بتاتا ہے. سورج کی روشنی کے تحت چلنے نہیں کرو. BCoz، مجھے نقصان نہیں کرنا چاہتا ایک میٹھا دوست رکھتے.
0,جی ہاں. مجھے audiitions لئے نیویارک شہر کے لئے آتے ہیں اور دوسری جگہ منتقل کرنے کی کوشش کر رہا ہوں.
0,میں نے پہلے آپ کو وہاں تک pocked
0,مبارک ہو. یہ بہت اچھا ہے. میں نے آپ کو مجھ سے آپ کا سکور نہیں بتانا بتانے کے لئے کہ یہ کیونکہ مجھے آرام بنا سکتا ہے کرنا چاہتا تھا. لیکن اس کی اتنی شیئرنگ کے لیے شکریہ مجھے کو حوصلہ افزائی
0,یو DONT مجھے یاد آتی ہے یا یو DONT میری ضرورت ہو تو مجھے کوئی بات نہیں سے Wud .. لیکن U واقعی مجھے وین کو چوٹ جایئں ڈیسک جلد اور AMP کی ضرورت ہے؛ ہیلپ ڈیسک جلد کی دیکھ بھال لے لو ......... بتانے سے Dont :-)
0,ارے جناب کیا کہ بل brison کا نام زبان اور الفاظ کے بارے میں ایک کتاب
0,ٹھیک ہے، اچھا، کوئی مسئلہ نہیں، اور شکریہ!
0,آپ معلومات کے لیے، IKEA تمام بڑے حروف کے ساتھ ہجے ہے. یہی چللا نہیں ہے. آپ نے سوچا کہ جب میں نے تمہیں چھوڑ دیا تھا، آپ مجھے اندر آیا جب گندگی کے درمیان بستر پر بیٹھے تھے. میں نے آپ کو کلاس سے گھر مل گیا کے بعد ہم جا رہے ہیں. کوشش کرتے ہیں اور مجھ سے بیکار نہ کریں. یہ میرے کم آپ کو سننے کے لئے چاہتے ہوتا ہے.
0,u're کیا جب مجھے کال کریں ...
0,G.W.R
0,تم نے کیا کہا میں نے ایک کمینے کے طور پر نشے میں حاصل سبب تم بہترین گھڑی
1,کٹ کی پٹی - آپ 150p بل کیا جا چکا ہے. Netcollex لمیٹڈ PO باکس 1013 IG11 سے Oja
1,HMV بونس حقیقی خصوصی HMV واؤچر کے 500 پونڈ جیتا جائے. بس 4 آسان سوالوں کے جواب. اب کھیلیں! 86688 مزید معلومات کے لیے HMV ارسال کریں: www.100percent-real.com
1,آپ کے لئے انتظار کر رہے ایک فوری پیغام ہے اس کو 08712402578 فوری طور پر کال کریں
1,thesmszone.com آپ there..do آپ کی اطلاع کے لئے ممکنہ دیکھنے سے یہ پیغام بھیجنا مفت گمنام اور نقاب پوش messages..im بھیجنے کی اجازت دیتا ہے ؟؟؟
1,بہت اچھے! آپ 4 * کوسٹا ڈیل سورج چھٹیوں یا ایک ¥ Â £ 5000 انتظار مجموعہ. 09050090044 ابھی toClaim کال کریں. SAE، ٹیسیایس، POBox334، STOCKPORT کے، SK38xh، کوسٹا ¥ Â £ 1.50 / PM، Max10mins
0,چوٹ لگی مجھے ... چڑھانے مجھے ... مجھے رلا ... لیکن میں نے مر جب اپنی زندگی کے آخر میں براہ کرم ایک میری قبر پر گلاب رکھنے اور احمقانہ I Miss U کی .. پڑے ایک اچھا دن BSLVYL کہنا
0,ERM ... جنگلی علاقہ ایونیو کہیں. آپ پارش میگزین حاصل کریں، اس کا ٹیلی فون نمبر وہاں ہو جائے گا.
0,وہاں TA ملازمتیں دستیاب ہیں؟ براہ مہربانی مجھے پتہ ہے کہ میں واقعی میں کام شروع کرنے کی ضرورت ہے کیونکہ دو
0,اییر مشکل 2 قسم. یو بعد میں آزاد پھر مجھے بتائیں پھر میں فون کروں این ڈانٹنا این یو بتائیں.
0,جی ہاں میں آزاد ہوں ...
0,اچھا اچھا، بلی سب چلے گئے Mate کرتی ہے. بس، ٹہلنا گیا ایک بار پھر! کنسرٹ سے لطف اندوز آیا؟
0,یو زائد کارلوس یہاں ہو جائے گا جلد ہی آئے
0,ضابطہ DAT پیارا ہے! ہم وہ کیا کرنا کچھ کے بارے میں سوچ کر سکتے ہیں! ایک اچھا وقت بعد میں IM تنہا :( XXX کیونکہ یو TXT آج رات بیمار شاید حاصل ہے.
0,میں نے اسے یو بلا 4 سے کچھ ضروری بیکار ہے لگتا ہے.
0,ہا ہا - جب آپ نے مجھے ہیلو ایڈ شوچالی نیچے کھولے تھے. ہیلو!
0,انہوں نے کچھ بھی بتانے سہارے. انہوں نے کہا کہ مجھ پر غصہ تمہیں ابی کو بتایا کہ یہی وجہ ہے کہ ہے.
1,کسی نے یو جانتے ہیں کہ تم سے کہا ہے کہ ہمارے ملنہ سروس 2 کانٹیکٹ! جو اندازہ کھچڑی؟ کال 09058091854 اب تمام نازل کی جائے گی. پی او BOX385 M6 6WU
0,یہ اتنا 2waxsto آپ چاہتے ہیں اور Wat کرتے وہاں R ایسا ہوتا ہے. وہ آئیں اور بیمار اس کے طبی انشورنس حاصل کر سکتے ہیں. اور وہ بچا اور بنیادی دیکھ بھال حاصل کرنے کے قابل ہو جائے گا. میں فی الحال اس کے لئے صحیح طبی انشورنس کے لئے خریداری کر رہا ہوں. تو صرف جمعہ کی صبح تل مجھے دے. آئی i.ll صحیح انشورنس کے لئے مجھے ہدایت دے سکتا ہے کہ اہم شخص کو دیکھ کر جب.
0,میں نے اپنی شیلف میں دس روپے رکھنے :) دو انڈے خریدنے.
0,مجھے اچھی طرح سے، بیب نہیں تھا میں نے اپنے گلے میں غدود سوج گئے ہیں ... تم کر کیا ختم کیا؟
0,الرحمن تبدیلیوں 2 دا رپورٹ بڑا ہے؟ میں نے پہلے ہی تبدیلیوں 2 دا پچھلے رپورٹ بنایا ہے کیونکہ.
0,کپتان اپنے کمرے میں ہے :)
0,bcaz موبائل مسئلہ ہے مجھے، بات نہیں کر سکتے. میں نے تم سے سننے کے کر سکتے ہیں لیکن تم میری آواز سن cann't ہے. لہذا میں آپ کو بعد میں بلاتا ہے.
0,ہیا STU WOT یو UP 2.IM میں اتنا TRUBLE گھر میں پل EVONE نفرت کرتا ہے مجھے بھی یو! WOT میں جہنم اے وی میں اب کیا کیا؟ Y گا U صرف بتا ME TEXT BCK مہربانی LUV DAN
0,S ... میں سے Mokka کھلاڑیوں کو لے جائے گا :)
0,اگر آپ اب بھی gautham ساتھ کھیل رہے ہیں؟
0,ارے مسٹر اور میں سمندر کے نقطہ نظر کے لئے جا رہا ہے اور ہم جنس پرستوں کے میرا مطلب گیمز کے ایک جوڑے رکھنے کر رہے ہیں! یا ختم ہونے پر مجھے ایک گھنٹی دے دو
0,# & gt؛ پر K، جیسن وہ ارد گرد ہو جائے گا میں نے ارد گرد کریں & lt وہاں ہو جائے گا تو کہتا ہے؛
0,معذرت. میں نے آپ کے لئے حاصل کرنے کے قابل ہو جائے گا. صبح ملتے ہیں.
0,Aight ساتھ ساتھ مجھے آگاہ کیا جائے
0,میں نے اس کا نمبر صاحب ہونے نہیں کر رہا ہوں
0,صرف اچھے ڈبل سم موبائل PA کے لئے تلاش کر رہا ہوں.
0,یہ غیر ضروری طور پر معاندانہ لگتا ہے
0,یار بال کٹوانے ملا. وہاں اب اس کی تازہ اپ
1,مبارک ہو! 2 موبائل 3G Videophones R تمہارا. اب 09061744553 پر کال کریں! غلط wid سے الرحمن ساتھیوں، ڈرامہ Java کھیل، Dload polyH موسیقی، noline rentl. bx420. IP4. 5we. 150pm
0,1Apple / دن = کوئی ڈاکٹر. 1Tulsi لیف / دن = کوئی کینسر. 1Lemon / دن = کوئی موٹی ہے. 1Cup دودھ / دن = کوئی بون Problms 3 لیٹر وتر / دن = کوئی امراض سے Snd جرم 2 کسے یو کیئر .. :-)
0,میرے خیال میں ہم نے پہاڑی چیز کا ایک بادشاہ کر رہے تھے سوچا.
0,nope کیا میں اب آن لائن آتی ہوں ..
