spam/ham,message
0,میں نے 2 _ تمام smth پوچھنا .. دا موجود لئی پر ایک کارڈ ہے بھول گیا ... کس طرح؟ ایک کے تمام چاہتا ہوں اس پر 2 لکھنے smth یا نشانی؟
0,اب میں اپنے گھر چھوڑ کر جا رہا ہوں.
1,ہیلو اپنا چلو بیبی، U گانے، نغمے R؟ میں ہفتہ کی رات پر تباہ کر دیا گیا تھا، یہ بہت اچھا تھا! ہفتہ وار چھٹی کیسی گزری؟ U مجھے یاد آ گیا؟ SP visionsms.com 150p / متن کو روکنے کے لئے لکھ سٹاپ
0,ایک تو تیار مجھے فون ...
0,Wewa 130. 255. Iriver تمام 128 MB ہے.
0,یہ ایک اچھی بات میں اب BW کے کنکشن ہو رہا ہوں ہے
0,Sry da..jst NW صرف میں گھر میں آئے تھے ..
0,کی ٹھنڈی ہے کہ وہ یہاں ہو جائے گا آپ کے ارد گرد ہیں جب ساری رات، سے Lemme جانتے
0,تم شہر میں رہ رہے ہیں؟
0,ہاں ہا ہا، 2 آانس ایک shitload کی ​​قسم ہے
0,ٹھیک U U ادا ہو جب مجھے شاپنگ لے سکتے ہیں = D
0,میری زندگی کا مطلب میرے لئے بہت، نہیں میں نے اپنی زندگی سے محبت، لیکن میں نے اپنی زندگی میں لوگوں سے محبت کرتا ہوں، کیونکہ دنیا بلاتا کیونکہ ان کے دوست، میں نے ان سے میرے عالمی :-) فون کریں .. جی :-) ..
0,ٹھیک ہے ہم آپ کو لاتی ہوں، طرح کریں & lt میں دیکھ؛ # & gt؛ پر منٹ
0,لیکن pls دوسروں کی زندگی میں پلے نہ.
0,میری دوپہر کا EATIN ...
0,Hmmm.but آپ ایک دن اسے دینا چاہئے ..
0,کوشش نہیں کی، G اور میں سر باہر نہ کرنے کا فیصلہ
0,کوئی PROB ٹھیک
0,اسبی بیمار کا جائزہ لینے کے لیے آتے وقت تم کو دے :-).
0,مارچ کو ختم کر کے، مجھے تیار ہونا چاہئے. لیکن اس بات کا یقین کے لئے آپ کو فون کروں گا. مسئلہ یہ ہے کہ میرے دارالحکومت کو مکمل نہیں ہے. کتنی دور آپ کے ساتھ. کس طرح کے کام اور خواتین
0,Tessy..pls میرا ایک کام کرتے ہیں. Pls کی Nimya..pls کو میری سالگرہ خواہشات اسے بھول Dnt کی تبلیغ. آج اس کی سالگرہ Shijas ہے
0,Pls اگر چینی کی بوجھ کے ساتھ ترجیحا پیپ بہت آہستہ آہستہ اس کی خوراک دے. آپ اسے دینے کے لئے ایک گھنٹے کا وقت لگ سکتا ہے. اور پھر کچھ پانی. بہت بہت آہستہ آہستہ.
1,فوری! آپ کا موبائل نمبر 07808726822 02/09/03 پر ایک Ã ¥ Â £ 2،000 بونس کالر انعام دیا گیا تھا! یہ ہمارے 2nd آپ سے رابطہ کرنے کی کوشش ہے! کال 0871-872-9758 BOX95QU
0,ایک آدمی کا استعمال کیا جاتا ہے لیکن یہ احساس کرنے کے لئے بھی گونگے کون ہے.
0,ٹھیک ہے dokey، IA ° A A · تھوڑا سا صرف کچھ چیزیں باہر چھںٹائی میں ختم ہو جائے گا.
0,ڈان کوئی دا:) کیا آپ کا ارادہ رکھتے ہیں؟
0,ہاں ٹھیک
1,WIN: ہم نے ایک فاتح ہے! مسٹر ٹی فولی ایک آئی پوڈ جیت گئے! مزید دلچسپ انعامات جلد، تو الرحمن موبائل پر نظر رکھنے یا www.win-82050.co.uk دورہ
0,میں نے نئی موبائل پسند کیا
0,کسی بھی وقت...
0,Mmmmmmm * آپ کے پاس snuggles * ... * گہری مطمئن سانس * ... * وسوسہ * ... میں، اتارنا fucking محبت بہت بہت میں بمشکل اسے برداشت کر سکتے ہیں ...
0,یار لیکن وہ کچھ غلطی ہو گئی بولیں.
0,ارے ویسے بھی مجھے کرنا ہے :-)
0,واہ اتنی صحت مند. پرانے ہوائی اڈے RD ہے Lor. کچھ اور THK سکتے. لیکن میں بعد میں میرے کتے غسل ب کر لیں گے.
0,اپنے خاندان بکنگ ٹور پیکیج WIF.
0,آپ کو جرات مندانہ کہا، تو مشعل بعد میں. یا ایک مشعل اور 2bold؟
0,خوفناک ہا ہا، میں نے اس پر آپ کو لینے کے لئے ضرورت ہو سکتی ہے، اگر آپ آج رات رہا کیا؟
0,یس مجھے آپ giv..its VL ٹھیک شکریہ عقل الرحمن خاندان عقل 1st کی تنخواہ سے لطف اندوز kano..anyway knw .. :-) ؛-)
0,ہوہ تو میں یو صرف میں 4 مزید لہ پہلے لیاو ... U 2 مزید دنوں طویل تک پہنچنے TOT سست ...
0,آئی ٹھنڈا راجکماری! میں نے گرم چپچپا سہ میں آپ کے چہرے کا احاطہ کرے گا :)
0,بگ brotherâ ° A A · واقعی سماجی Misfits کی اس شاور کے ساتھ فی بیرل ہے scraped ہے
0,افوہ میں THK میں ڈن مصحف enuff ... مجھے جانا پھر ایک بتانے چیک _ ..
0,S:) 8 منٹ دوپہر کے کھانے کے لئے جانے کے لئے :)
0,ارے. کیا ہوا؟ یو الرحمن سیل D پورے دن بند سوئچ. یہ ہیلپ ڈیسک اچھا ہے. ابھی U نگہداشت کرتے ہیں تو مجھے فون کر کل دے.
0,K addie اور AMP کروں گا؛ میں کچھ آرٹ کر رہے ہیں جب آپ گھر ملے تو میں یہاں ہوں گے
0,اٹلانٹا میں میرا چچا. تم لوگ ایک عظیم سمسٹر چاہتے ہیں.
0,سے Aiyo ... اس سبق اتنی جلدی ... میں اب بھی Sleepin کی، ہا ہا ... Okie، یو مجھے ہے Lor ڈبلیو جانے رہا ہوں گھر لیاو ماند تصدیق ...
0,Ã بتانا بھول _ smth .. سکتا ہے ایک _ نمبر کی طرح حصوں تو یہ واضح ہے کہ ..
0,ہاں. کچھ بھی ہے Lor، یو ڈن وان اگر یہ ٹھیک ہے ...
0,میں نے آپ اب بھی جاگ ... * محبت چمبن تو میری محبت، گھر پر ہوں ... *
0,HELLO آڑو! میرے کیک TASTS رسیلا!
1,مفت کھیل. O2 گیمز آرکیڈ سے میں Rayman گالف 4 مفت حاصل. 1st کی UR گیمز ترتیبات ملتا ہے. جواب شامل کریں، اس کے بعد بچانے & activ8. آرکیڈ پریس 0 کلید. Termsapply
0,بعد میں آج رات، آپ دلچسپی رکھتے میرے گھر میں ایک معمولی رقص وہاں ہو جائے گا؟
0,ہم ایک گھنٹے کی طرح میں اس جگہ سے کچھ لینے تو جیسن اس کی ٹھنڈی کہنا ہے کہ
1,آپ کے موبائل 10 مہینے تھا؟ مفت کے لئے تازہ ترین کیمرے / ویڈیو فونز کرنے کے لئے اپ ڈیٹ کریں. الرحمن ہی تعداد رکھیں اضافی مفت منٹس / نصوص حاصل کریں. ایک کال کے لئے متن YES
0,میں نے (کیریئر تل) FREE SMS بھیجنے کے لئے INDYAROCKS.COM پر ایک رابطے کے طور پر یو شامل کر لیا ہے. # & gt؛ پر؛ کوئی کو کریں & lt SMS - فون کتاب سے دور کرنے
0,میں نے پہلے ہی پہنچ گئے ہیں.
0,مجھے معلوم ہے کہ نہیں میرے بھائی سے پوچھیں. کچھ بھی نہیں مسئلہ یہ ہے کہ کچھ بات. بس میں نے بتایا.
0,K:) راکھ میں جھولی ENG :)
0,اور Wat وقت R نے ایک _ معاف کی ہاسٹل کرنے کے لئے جا رہے ہیں؟
0,گڈ مارننگ میرے عزیز Shijutta ایک عظیم اور AMP ہے ...........؛ کامیاب دن.
1,ابھی خلائی حملہ آوروں 4 ایک موقع 2 جیت orig آرکیڈ گیم کنسول. کھیل آرکیڈ (ایسٹیڈی WAP چارج) کے پریس 0 دیکھتے 4 شرائط + ترتیبات o2.co.uk/games. کوئی خریداری
0,اوہ K:) کہ جگہ کا تعین کرنے کے بعد ھ؟
0,قبضے کے لئے نہیں، خاص طور پر پہلے نہیں جرم
0,NT صرف یہاں تک کہ بہت سے وجوہات کی بنا پر گاڑی چلانے کے لئے وہ BBD..thts جو سے Chikku کہا جاتا ہے، اس کے بعد ایچ ڈبلیو ABT dvg cold..heard THT vinobanagar تشدد HW condition..and HW RU ہے؟ کوئی مسلہ؟
0,میں نے کل ٹیسٹ خریدا. اس کا تمہیں کچھ عین مطابق دن U ovulate.when 3wks کو 2 کے بارے میں 2U ملے گا جانتے ہیں کی اجازت دیتا ہے. لیکن pls pls ہم سے Dont کڑھنا. میں نے یو پریشان ر جانتے ہیں. Pls ہمیں آرام. اس کے علاوہ الرحمن ماضی کی تاریخ میں یو مجھے بتانے کی ضرورت نہیں کسی بھی چیز ہے؟
0,یو چاہتے ہیں تو ہم پیزا ہے
0,"مجھے عجیب گندگی اور دیکھتے رہنا ٹانگ تمام \ سے Woah \ ""تو یہ اصل میں مناسب ہے اور میں ہوں احساس تمام \"" اوہ \ """""
0,سالگرہ کی بہت بہت زیادہ مبارک ہو. میں نے آپ کو سالگرہ کی مبارکباد.
0,یس بہت اچھا. . جمعرات کو تیار .ہوشیار
0,میں نے ہسپتال دا میں ہوں. . میں شام کو گھر واپس آ جائیں گے
0,"یو کے \ سوچ؛) X \ """""
1,کیمرہ - آپ کو ایک SiPix ڈیجیٹل کیمرے سے نوازا رہے ہیں! 09061221066 Fromm کی لینڈ لائن پر کال کریں. 28 دن کے اندر اندر ترسیل.
0,Orh مجھے آپ کا کہنا ہے کہ اب وہ اب بھی ڈن یقین TOT.
0,آپ کو صرف + نشانی میں ڈال دیا، میرا نمبر کا انتخاب کریں اور پن دکھائے گا. ٹھیک ہے نا؟
0,زندگی کی خوبصورتی اگلے دوسری .. راز کے ہزاروں چھپاتا ہے جس میں ہے. میں ہر دوسرے الرحمن کی زندگی میں بہت اچھا ہو جائے گا چاہتے ہیں ... !! سے Gud N8
0,شکریہ U ڈارلنگ! IM ٹھنڈی شکریہ. چند سالگرہ 2 Nite میں پیتا ہے. بند 2morrow! سی یو soon.xxx خیال رکھنا
0,اگر آپ اب بھی کر رہے ہیں تو اس نے مجھ سے کہا کہ جیسے میں گیس حاصل کر سکتے ہیں جب میں واپس مل جائے، شاید کریڈٹ کارڈ کے چھوڑ
1,! آپ کا ہفتہ وار لالچ کے موبایل ٹونز ڈاؤن لوڈ، اتارنا کرنے کے لئے تیار ہیں اس ہفتے نئی ٹونز شامل ہیں: 1) پاگل میڑک-Axel f کی >>> 2) Akon میں-لونلی >>> 3) سیاہ آنکھوں-سے Dont P >>> ن میں مزید معلومات
0,ویسے لڑکا مجھے خوشی جی کچھ نہیں کے لئے applebees میں ساری رات ضائع ہوں
1,Cashbin.co.uk (اس ہفتے کے آخر نقد کے بہت سے حاصل!) www.cashbin.co.uk ہفتے کے آخر میں خوش آمدید محترم ہم دور ہمارے سب سے بڑے اور سب سے بہترین نقد رقم دینے مل گیا ہے !! یہ..
0,ہے Lor ٹھیک ہے ... یا یو مجھے نظر 4 U جانے وان؟
0,یو وان 2 مصحف دوپہر کے کھانے میں اب دا کینٹین میں ہوں.
0,بہت stressfull زندگی نہ کرو .. ہمیشہ ہنسنا وقت تلاش .. یہ آپ کی زندگی پر سال شامل نہیں کر سکتے! لیکن یقینا الرحمن سال کے لئے زیادہ زندگی اضافہ کر دیتی ہے !! سے Gud ni8..swt خوابوں ..
0,ارے، میں کی طرح لگتا ہے کیا غلط تھا اور KAPPA لوگ تعداد میں سے ایک آپ مجھے اس متن اور اس نے ارد گرد ہے تو دیکھنے سکتے ہیں کرنا چاہتے ہیں، اپنے فون پر اب بھی ہے
1,فوری! آپ کا موبائل نمبر گارنٹیڈ ایک ¥ Â £ 2000 انعام سے نوازا گیا ہے. لینڈ لائن سے 09061790121 پر کال کریں. دعوی 3030. درست 12hrs صرف 150ppm
1,شکریہ آپ کا سوال 4 آپ کی مسلسل حمایت اس ہفتے ہماری ڈرا 4 A ¥ Â £ 100 نقد in2 یو میں داخل ہوں گے. نئے امریکی صدر کو نام؟ TXT 80082 کو ANS
0,میں گھر پر ہوں. ڈاکٹر نے مجھے درد کا meds دی کہتی سب کچھ ٹھیک ہے.
0,اس کی ایک © صرف $ 140 اے آر ڈی ... ایک Ã¤ کم از کم تمام ARD $ 180 ... ایک © قیمت 4 A A © کنندہ کون آرام 2 bedrm ($ 900)
0,میں بھی! ایک خوبصورت رات XXX ہے
0,pleasured کیا جائے گا تیار :)
0,کال اور ای میل کے ذریعے ہم گاہک کو Hi.:)technical support.providing امداد :)
0,آپ کپ روکنے کے لئے اپنے راستے پر متن تو وہ کام کرنا چاہئے. اور اس کی بس ہونا چاہئے
0,Whens آپ کے ریڈیو شو؟
1,اپنے منفرد صارف ID 87239 گاہک خدمات 08708034412 کو ہٹانے بھیجیں سٹاپ کے لئے 1172. ہے
0,میں نے اس کے اب بھی دستیاب اگرچہ یقین نہیں ہوں اگر
0,watever سلسلے U واحد چیز atlast سے iz lonlines ساتھ Lotz کی ن بہت کچھ یادیں رہتا جس دیس دنیا میں تعمیر! احساس ..
0,چیرس LOU! جی ہاں یو نیوا آیا A سے Goodnite شرم آنی چاہیئے! C YA GAILxx
0,Hi..i پیسے دا ہو گیا :)
0,ہیلو، موبائل نمبر کریں & lt؛ # & gt؛ پر www.fullonsms.com یہ زیادہ دورے کے fullonsms.com لوگوں پر مفت ایس ایم ایس بھیجنے کے لئے ایک عظیم جگہ ہے پر ان کے رابطے کی فہرست میں شامل کیا ہے
0,ٹھیک ہے پھر یو مجھے بتا یو آنے والے وقت اور Wat بعد میں ہے Lor.
0,ایک بار پھر یو دہرانے ای ہدایات. الرحمن کے گھر کے اور Wat کا ای سڑک کا نام؟
0,بہت سے لوگ پہلی نظر میں خاص ہو گیا ہے، لیکن صرف بہت کم آپ کی آخری نظر تک آپ کے لئے خاص رہے گا .. زندگی ختم ہو جاتا ہے جب تک ان کو برقرار رکھنے ... شیخ! JAS
0,کافی ہے Lor. لیکن ڈن نے اس کا انتظار کیا وہ مطمئن ہو جاؤ بتا ...
0,معذرت بالکل بھول گیا * اس ہفتے راؤنڈ انہیں پاپ آپ اب بھی یہاں ہے تو کرے گا؟
0,یو آر سب سے خوبصورت لڑکی سے Ive کبھی دیکھا. یو آر میرا بچہ COME اور سی مجھ میں عام کمرے
0,اے ہم ڈینس اور مینا شامل ہو سکتے ہیں تو دیکھنے سکتے؟ یا ڈینس اکیلے وقت چاہتے کراسکتا
0,سین انہوں CBE میں اپنے چچا فنانس شامل ہونے کے لئے جا رہی ہے کہ کہا
0,جی ہاں ... ارے پھر جمعہ پر ایک دن ہم Miwa کی اور jiayin لے چھٹی جانے کراوکی پوچھ سکتے ہیں
0,مجھے کال، میں ایچ ایس بی سی سے سے Senthil ہوں.
0,خاص طور پر میں، میری ذاتی بیان میں سب بوسٹن کے بارے میں بات LOL بعد! میں نے اس کو تبدیل کر دیا woulda مجھے احساس ہوا تھا تو یہ NYC کہا! اب بوسٹن کہتے ہیں.
0,دونوں نہیں - بے شک اور ویسے یہ تھا یا!
1,ارجنٹ -Call 09066649731from لینڈ لائن. آپ کا اعزازی 4 * Ibiza میں چھٹیوں یا ایک ¥ Â £ 10،000 نقد انتظار مجموعہ SAE T & کاوچ سرفنگ PO BOX 434 SK3 8WP 150ppm 18+
0,قرآن زندہ مسیح کیا تم نے اتنی دیر لگا رہی ہے
0,ایک آج رات کے کھانے کے لئے Wat کی THK.
0,شکریہ. جی ہاں ہم سورج پر واپس آ رہے ہیں. ختم رات کا کھانا اب واپس 2 ہوٹل جا رہا. وقت اڑاتے ہیں، ہم آج بالکل ایک MTH 4 ٹرین ہو. ہم آنے والے بہت سے مزید مہینے مصحف گے امید ہے کہ ...
0,ہم جہاں ہم نے آپ کو چھوڑ دیا سے مخالف طرف ہو
0,ہاں. مجھے ای میں ہوں کیونکہ Izzit اب بھی بھاری بارش میں باہر ج نہیں کر سکتے MRT.
0,مجھے اپنا ریزیومے بھیجنے :-)
0,GD قسمت 4 الرحمن امتحانات :-)
0,اگلے ہفتہ ایک نہ سکے تو یا یو وہ سب پوچھیں. ان میں سے سب یہ کر سکتے ہیں تو میں ٹھیک ہے Lor ہوں.
0,معذرت کہ میرے چچا تھا. رابطے میں رکھنے I.ll
0,پیٹرک Swayze ساتھ دیکھا دوستوں اور گڑیوں گزشتہ رات یہ بہت اچھا تھا
1,URGENT یہ رابطہ U. آپ A ¥ Â £ 900 انعام کل سے اب بھی مجموعہ کا انتظار کر رہا ہے پر ہمارے 2nd کوشش ہے. دعوی کی کال اب 09061702893 کرنے
1,سانتا بلا! اپنے چھوٹوں سانتا کرسمس کی شام سے ایک کال چاہیں گے؟ 09077818151 پر کال کریں آپ کو وقت کی بکنگ کے لئے. Calls1.50ppm گزشتہ 3mins 30S T & C www.santacalling.com
0,بس گھر آو. میں نے یو دکھی ہونے کے لئے نہیں کرنا چاہتے
0,مجھے معلوم ہے کہ نہیں کیوں she.s آپ کے پیغامات نہیں مل رہا
0,اس کی ٹھنڈی لیکن ٹائلر تو ہم اس کے لیے خریدتے ہیں اور آج رات کے بعد اس کی جگہ پر اس کو چھوڑ جا رہے اتار پڑا. ہمارے کل کے حکم پر، ایک چوتھائی ہے اگر آپ کو کافی سمجھے؟
0,کار کی دکان میرے ساتھ چھیڑھانی گیا تھا جو وقت آدمی کاغذی کارروائی سے میرا فون نمبر مل گیا ہے اور کہا جاتا ہے اور مجھے texted. کورس کے اب وہ میرا پتہ ہو سکتا ہے کیونکہ میں نروس ہوں. مجھے یہ جان کر اس نے اسے فائرنگ حاصل کر سکتے ہیں، اپنے باس کو فون کر اسے بتا دوں؟
0,ریورس دھوکہ دے رہی ہے. یہ ریاضی نہیں ہے.
0,تم کس طرح اس کا انتظام کرنے کی منصوبہ بندی کرتے ہیں
0,ہیلو، یر، چیزوں didnâ ° A A · ٹی کافی ° ایک ایک منصوبہ پر جانے آہستہ آہستہ گھر AA طرف اور راستہ بند پھانسی کے ساتھ پیروی کی لنگڑا رہی ہے
0,تاخیر کے لئے معذرت. ہاں آقاؤں
0,جب یو پھر میں آ ن یو لینے ختم مجھ کو کال کریں.
1,نجی! 078498 **** 7 شوز 786 unredeemed بونس پوائنٹس کے لئے اپنے 2004 اکاؤنٹ اسٹیٹمنٹ. دعوے کو فون کرنے کے لئے 08719180219 شناخت کا کوڈ: 45239 06.05.05 ختم ہوجاتا ہے
0,کیا میری اپنی سے Oga منحصر ہے. گھر میں میرے فون کو چھوڑ دیا اور صرف الرحمن پیغامات دیکھا. آپ اچھے ہیں امید ہے. ویک اینڈ اچھا گزرے.
0,اگرچہ، میں اسے کس طرح اہم ہے کہ میں نے کبھی میرے ساتھ ہوا ہے کہ سب سے بری چیز کے چہرے میں سزا ایک غیر تسلی بخش سوچ کے ساتھ میری جگہ میں ڈال دیا جائے کہ سمجھ فکر نہ کرو. BRB والا اپنے آپ کو قتل جاؤ
0,ہنی، آپ pls وہ کتنا نائجیریا میں Predicte فروخت باہر تلاش کر سکتے ہیں. اور کتنی بار اس کا استعمال کیا جا سکتا ہے. اس کا بہت اہم سوموار سے پہلے ایک جواب ہے کرنا
0,ای منتظم نے عمارت؟ میں نے قدرے اوائل ب ہو سکتا ... میں پہنچ رہا ہوں جب میں یو فون کریں گے ...
0,FYI میں اب یو ایس ایف پر ہوں، کمرے، جب بھی طرف سوئنگ
0,میں اندر کریں & lt کال کر سکتے ہیں؛ # & gt؛ پر منٹ اگر thats کے OK
0,d دن میری پیاری میٹھی دل .. HAPPY BIRTHDAY عزیز کے Ummmmmaah کئی بہت بہت مبارک ہو
0,ایک عوامی ہنگامی ہال ایسا کرنے کا کوئی گھر کا کام ...
0,جو کھو کے بعد یہ ہو رہی ہے ... دوسری سے پہلے پہلی ...: کچھ بھی صرف 2 حالات میں قابل قدر ہے
0,میں بھی. مارک میرے نسخے لینے کے لئے ہمیشہ کے لئے لے جا رہا ہے اور درد واپس آ رہا ہے.
0,الرحمن کاغذ کیسا ہے؟
0,چھوٹے صلاحیت سے ایک ہے؟ کافی سابق ...
1,باہر کا انتخاب کریں آپ بیبی ویڈیوز چیک کریں @ sms.shsex.netUN fgkslpoPW fgkslpo
0,میں ٹھیک ہوں! میں تمہارے بارے میں سوچ رہا ہے ...
1,U ایک فاتح یو خاص طور پر منتخب کیا گیا AVE R 2 وصول ¥ Â £ 1000 نقد یا ایک 4 * چھٹی (پروازوں انکا) ایک لائیو آپریٹر سے بات 2 کے دعوی 0871277810710p / منٹ (18)
0,:-) :-)
0,یہ مککیبازی نہیں سوچا ... || سات میں نل اور عمومی spile میں پیو. || گیس سینٹ پر کہ پب وسیع سینٹ دور نہر طرف سے ہے. || ٹھیک ہے؟
0,میں سونے جا رہا ہوں. میں نے سفر کا تھکا ہوا ہوں.
0,ہا ہا، صرف کیا کہ میں سوچ رہا تھا
0,جی ہاں لیکن یہ اب میرے مسائل نہیں دے رہا ہے تو میں jus کے اسے چھوڑ دیں گے mayb ...
0,کوئی LOL. بس آپ کا دن تھوڑا زیادہ دلچسپ بنانے کے لئے کی کوشش کر رہے
0,کتنی دیر تک آپ کو جواب مل جائے اس سے پہلے صرف اگلے سمسٹر کے تل داخلے ملتوی
0,"لفظ \ شکست \ شاہ سے Maat \ ""شطرنج میں فارسی جملہ \ سے آتا ہے"" ""اس کا مطلب؛ \"" بادشاہ مر چکا ہے .. \ ""سے GoodMorning .. ایک اچھا دن ہے .. :)"""
0,پو ڈی :-) :) :-) :-) :-). کوئی ضرورت ملازمت آہا.
0,چوہی. ارے U کبھی اگلی موضوعات کے لئے ووٹ دیا؟
1,2004 سے نیا موبائل، جانا ہوگا! TXT: کوئی نوکیا: 89545 & کلیکٹ تمہارا آج! سے صرف ¥ Â £ 1. www.4-tc.biz 2optout 087187262701.50gbp / mtmsg18 TXTAUCTION.
0,میں نے آپ کے پیشاب سے Tonite جلتا امید ہے.
0,OH رسم. WELL IM WITH MY بہترین ساتھی پیٹ، میں نے 4 ایک ہفتہ + NOW ساتھ باہر گئے جو 2GEVA پھر تھے. ITS زیادہ عرصہ تک محفوظ کیا گیا کے مقابلے میں ایک ہفتے.
0,گرمیوں میں ایک دوسرے کے ساتھ پارٹی کے لئے انتظار نہیں کر سکتے!
0,.... فوٹوشاپ میرے کمپیوٹر سے بند ہوتا ہے.
0,تمام لڑکے آج میرا مذاق بنا دیا. ٹھیک ہے میں کوئی مسئلہ نہیں ہے. میں نے ابھی صرف مذاق کے لئے ایک پیغام بھیجا
0,کہ مسائل میں سے ایک ہے لیکن کیلی فورنیا ٹھیک ہے. اس کے انتظام، تاکہ کوئی برف
1,نجی! شوز 800 غیر چھڑا ایس I. M. پوائنٹس کے لئے اپنے 2003 اکاؤنٹ اسٹیٹمنٹ. کال کریں 08715203652 شناخت کا کوڈ: 42810 29/10/0 ختم ہوجاتا ہے
0,ہاں .... Mayb سے Shoppin علاقے سے ایک ای کوشش کریں، لیکن ہوٹل کے ای نام بھول سکتا ...
0,بہت اچھے، جو کہ جلد ہی یا بعد میں آج رات ہونے والا؟
0,مجھے یقین ہے کہ آن لائن کام کے بارے میں تفصیلات کی ضرورت ہے.
1,تم جیت گئے! ایک قابل قدر ووڈافون گاہکوں کے طور پر ہمارے کمپیوٹر ایک ¥ Â £ 150 انعام جیتنے کے لئے آپ اٹھایا ہے. جمع آسان ہے. بس 09061743386 پر کال کریں
0,اللہ inshah آپ too.pray لاپتہ
0,Pls مجھے ایشلے بتانے میں اوہ اس کا نمبر مل سکتا ہے کہ میں مدد
0,اب میں فرار تھیٹر میں ہوں. . چند منٹ میں KAVALAN دیکھنے جا
0,S.this جیتنے کے امکانات کو بڑھانے گا.
0,یا تو راستے میرے لئے کام کرتا ہے. میں ہوں کریں & lt؛ # & gt؛ پر سالوں کا. کہ نہیں ہے آپ کو پریشان امید ہے.
0,ہو سکتا ہے کہ آپ اس کے بجائے ایسا کرنے کے لئے کچھ اور تلاش کرنا چاہئے ؟؟؟
0,ایک wife.dont مانگ کے حقوق کے طور پر شوہر too.Lets دیکھیں it.i کوشش کر رہا ہوں حاصل
0,مجھے اپنے نئے گھر کو پسند کیا
0,میں ٹھیک ہوں. امید آپ بھی ہیں
0,اس کے علاوہ شمالی کیرولائنا اور ٹیکساس اے ٹی ایم، آپ کو صرف ٹیسٹ کے نتائج کے لئے GRE سائٹ اور تنخواہ کے لئے بھیجا جائے کرنے کے لئے جانا چاہتے ہیں.
0,آپ کو بھی...
0,جی میری جان! میں نے آپ کی بلی کھولیں بڑھاتے کرنے کے لئے کی ضرورت ہے!
