spam/ham,message
0,نے بھی اس سے میں نے کہا HAPPY BIRTHDAY بتائیں
0,Y بشن لئی ... میں ایک _ کہنا ہے کہ لیوینڈر TOT؟
0,بو کس وقت یو باہر نکلتے؟ U آج شاپنگ مجھے لینے والے تھے. :(
0,ابھی U کی طرح manky scouse لڑکے اسٹیو کی طرح آواز! میں نے دا بس home.wot پر سفر ہے یو inmind گیا ہے 4 تفریح ​​مسترد حوا؟
0,FYI میں نے ایک فوری شاور لے جا رہا ہوں، طرح کریں & lt میں ایپسیلون میں ہو؛ # & gt؛ پر منٹ
0,منگل کی رات ر U 4 رئیل پر
0,ہاں جب دوبارہ Appt کے ہے؟
0,بس ہو گیا باہر کلاس جم جانےوالا.
0,میں نے بھیجا کریں & lt کرنا چاہتے ہیں؛ # & gt؛ پر آج mesages. آئی وائی. مجھے تکلیف دیتا ہے تو معذرت
0,ایک تمام لکھنے یا اور Wat ..
0,ہا! میں کہتا ہوں کہ میں نے صرف راستہ یو لگ رہا تھا میں کچھ بھی نہیں پڑھا تھا. میں نے پب میں جمعہ کے لئے اس کے سوا میں نے 2 ہو اندازہ پسند نہیں کرتے ....!
0,اس کی ایک ویلنٹائن کھیل. . . تمام الرحمن دوستوں کو مسترد MSG بھیجیں. . 5 جوابات د ایک ہی تو کسی شخص ر تو واقعی یو محبت کرتا ہے. . Ques- جو رنگ مجھے سوٹ بہترین؟
0,ہیلو:) آپ کو چھوڑنے کے بارے میں وحیدہ فاطمہ کرنے کے لئے کہا تھا؟
0,urself TMR لطف اٹھائیں ...
0,آپ اب بھی ارد گرد؟ میں نے ایک نصف کے 8th استعمال کر سکتے ہیں
1,یو 447801259231 لگ رہا ہے کے ساتھ 2 سے رابطہ ایک خفیہ مداح ہے انڈر مل وہ کون R * 09058094597 پر UR کیا خاص کال سوچتا ہے کہ جو ظاہر باہر
0,تم نے میری ID ثبوت اور عمومی لیفٹیننٹ ہمیں واپس دے؛ # & gt؛ پر روپے ہم آپ کو کام کرنے کی اجازت گا. ہم دن کے اندر اندر آپ کے گھر کے لئے آئے گا
0,ایک بیوٹی نوٹوں oredi ... کیونکہ میں پاروں کے rem میں مل گیا ...
0,جی ہاں. کرایہ بہت مہنگا اس کا راستہ اس لیے ہم کو بچانے کے لئے ہے.
0,رات کو ایک اور دن کے لئے ختم ہو گیا ہے، صبح ایک خاص انداز میں آئی ہے. آپ کو نیلے نیلے خلیج میں دھوپ کرنوں اور پتے اپنے خدشات طرح مسکرا سکتا ہے. سے Gud mrng
0,نسل درد عزیز؟ Y یو مسکراتے ر؟
0,پرلطف حقیقت: اگر آپ کو لگتا ہے کہ آرمنڈ آخر میں ایک رواداری یا کچھ شٹ، انہوں نے 2 مشاہدات کی طرح میں گڑبڑ ہو جاتا ہے کتنا وہ نوش غور کر تعمیر کریں گے، اگرچہ
1,اہم معلومات 4 اورنج صارف 0789xxxxxxx. آج آپ خوش قسمت دن ہے! http://www.urawinner.com پر لاگ وہاں کیوں ایک تصوراتی، بہترین اچانک آپ کا انتظار کر باہر 2find!
0,معذرت، میں آپ کو اس پر مدد نہیں کر سکتے.
0,زبردست. اگر آپ نے اکاؤنٹ نمبر بھیج دینا چاہئے.
0,HELLOGORGEOUS، یو سکا؟ MY fone جانا کاریبار LST NITW WEN یو TEXD مجھ پر تھا. HOPEU AD ایک اچھا WKEND AS IM یقین U لگ 4WARD 2 C-IN یو 2MRW LUV JAZ DID
1,ہمارا ڈیٹنگ سروس پوچھا شرم کسی کی طرف سے 2 کانٹیکٹ U رہا ہے! کال 09058091870 اب تمام نازل کی جائے گی. POBox84، M26 3UZ 150p
0,ایک صرف میرے مندرجات صفحہ بھیجیں ...
0,رات کی میٹھی، ٹھیک سے سو! میں نے ابھی ایملی گلاب کے Exorcism میں دیکھنے کے لئے کیا گیا ہے اور دوبارہ سو نہیں سکتا ہے! لگائے اور snogs!
0,"\ بارے U پسند ملا \ کیسے استعمال اس کو آپ کے پاس جو ملا \ ""اچھا ni8"" ""\ بارے میں سوچو"" کیا سوچو '"
0,میں کر سکتے ہیں حق یہ نہیں دوسرا، ہوگا لوگ پہلے مارا
0,قسم جذبات ہولدار dsn't Words.Evry خواہش dsn't ہولدار Prayrs .. U مسکراہٹ، D ورلڈ u.Othrwise عقل پر بھی بی مبارک .. گڈ مارننگ u.So عقل 2 رہو bunches کی طرح آنسو dsn't کا ڈراپ ڈی، مسکراتے رہیے:-)
0,آپ کے بارے میں کیا تو. اپ کو کیا یاد ہے
0,Ujhhhhhhh کمپیوٹر sandiago اور parantella گلی ایڈریس کے ساتھ باہر بھیج دیا. WTF. کو poop.
0,مم جی ہاں عزیز میں آپ دونوں کو گلے لگا رہا ہوں کہ کس طرح. :-P
0,مسترد سویٹر FR آم لیکن پھر میرے سائز پہلے سے ہی اتنا پریشان پسند ہے.
0,1 میں پچھواڑے میں ایک بڑے پیمانے پر درد ہوگا اس کا نمبر اور 2 اس کے پاس نہیں ہے اور میں نہیں بلکہ ملوث نہیں ملے گا ممکن ہے کہ اگر
0,کسی بھی وقت ہے Lor ...
1,آپ کو ایک نئی ویڈیو ہینڈسیٹ چاہتے ہیں؟ 750 کسی بھی وقت کسی بھی نیٹ ورک منٹ؟ لا محدود متن؟ Camcorder کے؟ جواب دیں یا ڈیل ہفتہ AM لئے اب 08000930705 پر کال کریں
0,دونوں کے درمیان دوستی کی طہارت کا نام دیکھ کر صرف مسکرانے فارورڈ message..Its پڑھنے کے بعد مسکراتے بارے میں نہیں ہے. سے Gud evng
1,ؤر توازن اب ایک ¥ Â £ 600 ہے. اگلا سوال: سنگ میل مکمل، بڑے، A. باب، بی بیری یا سی بین؟ ہائے A، B یا 83738. اچھی قسمت کو سی!
0,مجھے fine..absolutly ٹھیک
0,K اور تم ہو چاہتے میں ایسا کرنے کی رضامندی کے فارم ہے کرنے کی ضرورت نہیں ہے: V
1,ؤر TONEXS سبسکرپشن کی تجدید کی گئی ہے اور آپ کو ایک ¥ Â £ 4.50 الزام عائد کیا گیا ہے. آپ 10 سے polys اس ماہ منتخب کر سکتے ہیں. www.clubzed.co.uk * بلنگ MSG *
1,آپ ایسا نہیں کرتے ہیں تو آپ کا انعام کسی دوسرے گاہک کے پاس جائیں گے. T & C www.t-c.biz اوپر 18+ 150p / منٹ پولو لمیٹڈ سویٹ 373 لندن W1J 6HL مصروف ہے تو واپس کال کریں
0,9ja میں میں مشعل کتنا ہوتا ہے.
0,کچھ نہیں کر رہے، پھر یو رات کا کھانا ہماری W ہونے نہیں؟
0,آپ کیسے ہو. بس تم پر اپ کی جانچ پڑتال
0,یہ کام کیا لیکن انٹرنیٹ کنکشن وی سست اور کانا ° A A · ٹی بھیج. براہ کرم بعد میں یا پہلی بات ٹومو کوشش کریں گے.
0,میتھیوز یا ٹیٹ یا ایڈورڈز یا اینڈرسن
0,ہاں اس بات کا یقین چیز ساتھی اڈا میری ساری چیزیں حل کر لی لیکن IM یہ کون ہے .ویسے لئے ہیکس فروغ دینے ویسے بھی آواز چل رہا ہے؟ Dont Know کی تعداد. مذاق
0,کوئی ضرورت لار میں انگن جانا؟ آج فنون میں اپنے شیش کیونکہ ...
0,عظیم مشورہ شکریہ امید کارڈف اب بھی موجود ہے - شکریہ شہد لیکن اب بھی کچھ بھی میں اب یہ تھوڑا سا چھوڑ دیں گے تاکہ 2 نہیں اس بھیڑ اور بعد میں کوشش کریں گے نہیں سنا ہے!
1,اگر آپ کو ایک نیا نوکیا 3510i رنگ فون بھیج دیا گیا کل چاہتے ہیں؟ کسی بھی موبائل + 100 درسی + FREE camcorder کے جواب یا کال کریں 8000930705 200 مفت منٹ کے ساتھ
0,، IM .. اسنوبورڈنگ کے سفر پر. میں سوچ رہا تھا ایک دوسرے کے ساتھ befor سے ہم ملیں اور معاملہ کی قسم سلام go..a آپ کی منصوبہ بندی ہر کسی کو حاصل کرنے کے لئے تو؟ چیرس،
0,S.i'm لائیو میں یہ دیکھ کر ..
0,پھر آپ نے دیکھا، ہم یہاں تمام christmassy ہو!
0,K میں تیار ہوں، کریں & lt؛ # & gt؛ پر ؟
0,آپ کو پتہ ہے خدا کو اپنی انگلیوں کے درمیان خلیج پیدا کیوں .. کرتے ہیں؟ ، تا کہ جو آپ کے لئے بنایا گیا ہے آتا ہے اور AMP؛ محبت کے ساتھ آپ کا ہاتھ پکڑ کر ان لوگوں کے فرق کو برتا ہے ..!
0,زمین پر جرأت کے عظیم ترین ٹیسٹ دل کھونے کے بغیر ریچھ کو شکست دینا ہے .... GN TC
0,اپنے نئے سال کے منصوبے کیا ہیں؟
1,RECPT 1/3. آپ کو ایک رنگ ٹونز حکم دیا ہے. آپ کے آرڈر پر کارروائی ہو رہی ہے ...
0,Baaaaaaaabe! اٹھو! میں تمہیں یاد کرتا ہوں ! میں نے آپ چاہتے ہیں! مجھے آپ کی ضرورت ہے!
0,صرف صرف آپ کو نظر انداز نہیں کیا، یہ پیغام ملا. جی ہاں میں تھا. یہ ہے کہ خریداری
0,عزیز: - / کیوں آپ کا موڈ آف ہے. میں ڈرائیو کرنے کی تو میں نے بھائی کو گاڑی چلانے کے نہیں کر سکتے
0,جب والد صاحب کو واپس حاصل کیا.
0,آپ طب کے کالج جانے اور تعلیمی محکمے کا دورہ، تعلیمی سیکرٹری بتا موجودہ صورت حال کیا ہے اور وہ وہاں منتقل کر سکتے ہیں تو براہ کرم دریافت کریں کو شعلہ بتا سکتے ہیں. وہ ایک ہی بات اور lautech لئے Sagamu جانچ کرنا کسی سے پوچھنا چاہئے. اس کے اہم وہ نائجیریا میں اپنی طبی تعلیم مکمل کرتا ہے. اس کی کم مہنگا بہت کم مہنگا. جب تک وہ نیوزی لینڈ میں شہری کی شرح ہو رہی کریں گے.
0,ہاں صرف ہماری زندگی کے ایام کو دیکھ کر ختم کر دیا. مجھے اس سے محبت ہے.
0,پاروں گوگل ن تلاشی 4 qet جانے ...
0,ہم ہیں bcoz کئی بار ہم نے اپنے بہترین والوں کو کھو دیں
0,اچھے دوست کو وقت سے باہر، ایک دوسرے .. قریبی دوست ایک دوسرے کو سمجھنے کے لئے دیکھ بھال ... اور ہمیشہ کے الفاظ سے باہر سچے دوست رہو. سے Gud ni8
0,صرف گھر واپس حاصل کرنے کے
0,معذرت، میں بعد میں فون کریں & lt گے؛ # & gt؛ پر منٹ
0,پاروں دا براؤزر ن سرف کھولنے ڈائل استعمال کرنے کے لئے ڈن ضرورت ...
1,ہمارے رجسٹرڈ صارفین کی ایک کے طور پر یو کھینچنا 4 100 جی.بی. درج کر سکتے ہیں ENTER ساتھ جواب دے کر تحفہ واؤچر. رکنیت ختم متن کو روکنے کے لئے
0,بہت اچھے، کی طرح کریں & lt بعد یہاں کسی بھی وقت حاصل کرنے کے لئے کی منصوبہ بندی؛ # & gt؛ پر ، میں متن دونگا آپ کو ایک چھوٹا سا میں تفصیلات
0,کی دیکھ بھال اور نیند میں life.you صرف پر that.i انتظار کریں گے اس بات پر یقین کرنے کی ضرورت ہے لیکن us.GET درمیان کوئی زیادہ مکالمات کہ time.Your خاندان کی طرف سے اس بات پر یقین بہت ہوش میں آپ کے لئے ختم ہو گیا ہے well.you تبدیلی کے لئے سیکھنے کی ضرورت ہے لے لو. ان کا احترام ہے لیکن یو میری زندگی میں کوئی کردار نہیں ہے overemphasise.or.
1,"جیتنے کے لئے آپ کا موقع کے لئے ایک مفت بلوٹوت ہیڈسیٹ پھر صرف \ ADP \ کے ساتھ واپس جواب ""کے"""
0,تم نے بھی نہیں کیا NA ہیلو ہیلو ہیلو ہیلو ہیلو حاصل
0,میں نے ان کو نکالنے میں کرنا ہوگا تاکہ یس لیکن یہ اندرونی subs کے ظاہر کھچڑی
0,میں نے کچھ غلط معذرت ڈی نے کہا تو :-)
0,ایک شخص کے دکھ کی کہانی - گزشتہ ہفتے میرے b'day تھا. میری بیوی نے مجھے خواہش did'nt. میرے والدین ن تا بھول گیا میرے بچے نے کیا. مجھے کام کے لئے گئے تھے. یہاں تک کہ اپنے ساتھیوں کی خواہش نہیں کی.
0,مجھے چیلنج ہے کہ god.You میں کیا لکھ بجائے آپ immed جواب دینے پر بالکل ہے نہ کہنا کہ کس طرح بیوکوف.
0,جی ہاں میں نے اپ کو پورا کرنے کے لئے تیار ہوں جب تک، میں نے آپ کو متن دونگا قابل ہونا چاہئے
0,V بھی skint لیکن bevies.waz چند سے Gona جانے ملو & othrs چمچ لیکن JST بن watchng سیارے زمین اور سوفی میں اندازہ وی comfey ہے؛ مجھے GD رات یہ ہولدار دکھانے نہ تو
0, کہ وہ ایک دن least5times پر چھوڑنے رہا ہوں کہ میں زیادہ سے زیادہ نوٹس لینا wudn't اتنا کہتے ہیں. نہیں، وہ کوئی اعتراض نہیں کیا. آپ دوبارہ اسے دیکھنے والے ہیں؟ تم آج رات ٹاؤنٹن میں آنے کے لئے چاہتے ہیں؟ U مجھے سب کے بارے میں بتا سکتے ہیں!
0,آپ مفت حاصل کرتے ہیں، مجھے فون
0,کس طرح آپ کی چھوٹی darlings اب تک اس ہفتے کیا گیا ہے؟ ایک کافی رن ٹومو کی ضرورت ہے؟ یہ ہفتے کے اس وقت ہے یقین نہیں کر سکتے ہیں پہلے سے ہی ایک ° ایک _
0,ٹھیک ہے میں آپ MSG میں اپنے گھر چھوڑ B4.
0,پھر بھی مغربی ساحل پر ... Haiz ... ایک ایک 'ہمیشہ کے لئے واپس آنا لے لیں گے ...
0,MMM ... بھاڑ .... مجھ سے میری کرسمس
0,ٹھیک. مشورہ کے لئے شکریہ. آپ رات کو باہر کا لطف اٹھائیں. کچھ نیند حاصل کرنے کی کوشش 'ایک ...
0,اکثر آپ کے چہرے کی کتاب کی حیثیت کو اپ ڈیٹ :)
0,بس اب آپ کی message.it K دا دیکھا :)
0,یہ یو کھایا کچھ تھا؟
0,کیا پیسے کے بارے میں بینک کے کہا تو؟
0,اییر ڈن یو پریشان لیاو ... THK یو قرعہ 2 ہے پچھاڑی الرحمن الماری آتے ہیں ...
0,میں نے ابتدائی ب گھر PROB گے تاکہ ارے وہ فلم آج رات کو دیکھ کر نہیں کر ر ...
0,یار ہے Lor ... U کس طرح نوح؟ U بھی DAT روٹ استعمال کیا؟
0,2mro میں جم مچان کو نہ آ رہا ہوں. شب بخیر.
0,سے Dont لگتا ہے کہ آپ برطانیہ سفر کے لئے پیلے رنگ کے کارڈ کی ضرورت ہے. اگر کوئی پہلے چلا گیا ہے کہ کہیں. آپ کو اس کے بس کریں & lt کرتے ہیں تو؛ # & gt؛ پر روپے
0,U ابھی تک 4 مجھ میں دا لب مجھے ملا چیزیں havent ہے ختم دیکھ سکتے ہیں.
0,اچھا ہے! IM اب سونے جا. ایک اچھی رات ہے!
1,ب نہ فلاپی ... ب تیز اور خوش کرو! تصویر اپ لوڈ کی کال 08718730666 (10P / منٹ) کے ساتھ صرف ہم جنس پرستوں چیٹ سروس. 2 سٹاپ ہمارے نصوص 08712460324 پر کال کریں
0,آدمی کریں & lt پر قتل کیا گیا تھا coz کہ ہاؤس-نوکرانی، قاتل ہے؛ # & gt؛ پر جنوری .. عام تعطیل کے طور پر تمام govt.instituitions مراسلہ office..understand سمیت بند ہیں؟
0,کس طرح آئے U کوئی تعلق نہیں ہے؟
0,کچھ بھی کبھی آسان ہو جائے گا. لیکن زندگی اور محبت پر ایک خطرہ لینے کے لئے نہیں ایک وجہ کے لئے تلاش کیا جائے نہ کرو
0,میں نے آپ کی خوبصورت مال غنیمت سمجھنا چاہتے ہیں :)
0,میں نے ایک چائے کے لئے اس کو ملا ہے. جس کا ذائقہ یقین نہیں
0,میں نے 2 باگ اب مجھے جلد ہی پہنچنے laready جا رہا ہوں. یو پہنچنے؟
0,محترم میں نے آپ کے الفاظ کو خوش انکار نہیں کر رہا ہوں
0,تم جانتے ہو میرے پرانے ڈوم میں نے کل کے بارے میں بتایا؟ اس کا نام راجر ہے؟ انہوں نے کہا کہ گزشتہ رات میرے ساتھ رابطے میں ہے اور 2 بجے آج اس سے ملنے کو مجھ سے چاہتا ہے
0,BACK TO ٹمپا FFFFUUUUUUU COME
0,2 میری BA ¥ ایک دن، Y اور کچھ منانے؟
0,آپ کے لئے میری کرسمس بھی ینی!
0,براہ مہربانی مجھے بتائیں کہ آپ کو آپ کے بارے میں بات کر رہے تھے کہ خصوصی اسٹاک میں سے کچھ ہے
0,میں نے ان کو بھیجا. کیا تمہیں پسند ہے؟
1,ارجنٹ UR EuroDisinc سے Trav، سے Aco & Entry41 یا ایک ¥ Â £ 1000 کے لئے ایک اعزازی سفر نوازا. 87121 18 + 6 * ایک ¥ Â £ 1.50 (moreFrmMob. ShrAcomOrSglSuplt) 10، LS1 3AJ کرنے DIS TXT کا دعوی کرنے
0,بہت اچھے، ایک منٹ میں وہاں ہو جائے
0,"اور یہ مسئلہ ہے. آپ \ julianaland \ ""آپ کے ارد گرد کیا ہو رہا ہے سے غافل ہوں وہی چیزیں مسلسل کہتے میں کے ارد گرد چلنے اور وہ ایک کان میں اور دوسرے کو آپ آپ کرنا چاہتے ہیں جو کچھ بھی کر دور جانا جبکہ جاؤ. ایسا لگتا ہے کہ آپ ڈان 'نہیں ہے T پتہ ہے کہ کیوں مجھے پریشان ہوں - یہ کہ تم مجھے بتاو جب تم نے کیا مجھ کو پریشان کرنے کے لئے جا رہی ہے نہ مدد کے اس وقت میں پاگل ہوں جب آپ حیران کیا کرنا چاہتے ہیں ""."
0,میں نے بتا دیا ہے کہ آپ سب کچھ رک جائے گی. بس سے Dont اس کے پانی کی قلت پیدا ہونے دیں.
0,یا مجھے لگتا کریں & lt؛ # & gt؛ پر منٹ
0,میں گھر پر ہوں. اے آر ڈی اور Wat وقت U پہنچ جائیں گے؟
0,"MSG دھاوا:. وین یو ڈی phne اٹھا، یو کا کہنا ہے کہ \ HELLO \ ""یو knw WT ڈی خوش کی ؟؟ حقیقی معنی کیا یہ ایک لڑکی کے د کا نام ہے .. جی ہاں .. اور یو knw کون ہے!. DAT لڑکی ؟؟ \ ""مارگریٹ ہیلو \"" وہ ہے ڈی girlfrnd چ Grahmbell جو invnted telphone ... اخلاقی:.... ایک ایک شخص کے گھ نام 4get سکتے ہیں"
0,"آپ اسے یا کچھ \ یو ایس ایف dogwood کو ڈرائیو \ ""اوپر دیکھو mapquest کرنا چاہتے ہیں تو"
0,Aight میں بس بعد میں آج رات آنے کی منصوبہ بندی کرنا چاہئے؟
0,مر ... میں نے غلطی سے خارج کر دیا گیا ای MSG میں ای سم آرکائیو میں 2 رکھ لگتا ہے. Haiz ... میں بہت اداس ...
1,"نوٹس کی موبائل ڈیٹ خوش آمدید اس MSG FREE روزانہ 150p پر لگائی جاتی 08719839835. مستقبل MGS کو آپ مفت کالنگ دے رہا ہے. بھیجیں ""89123 کے لئے"" سٹاپ جانا \ \ منسوخ کرنے کے لئے"
0,یہ آپ کو ایک عظیم دن کے خواہاں رہا ہے. سے Moji آپ کی پیشکش کے بارے میں بتایا اور ہمیشہ کی طرح میں اواک تھا. تم میری طرف سے اور اس کے شاندار پر بڑی حد تک جانے کو اتنی آسانی سے پیش کرتے ہیں. میرا امتحان اگلے جمعہ ہے. بعد میں زیادہ رابطے میں رکھیں گے. معذرت.
0,آپ کے جواب آج کے لئے ایک بار پھر شکریہ. جب الرحمن ویزا میں آ رہا ہے. اور یو اب بھی Gucci کے اور تھیلے خرید ر. میری بہن چیزوں میں واقعی میرا اپنا پیسہ کمانے کے لئے کس طرح کے بارے میں سوچنے کی ضرورت ہے تاکہ چچا جان نے بھی ان کے اپنے ہی بل ہے، آسان نہیں ہیں. بعد میں ان شاء.
0,معاف کیجئے گا میں آپ کو آج رات کو کیا گزشتہ رات flaked، گندگی سنجیدگی میرا روممیٹ کے ساتھ نیچے جا رہا ہے؟
0,انہوں نے کہا کہ میں نے لمبے بال اور Wat WIF خوبصورت لگتی کہی. لیکن میں وہ بہت مختصر 4 مجھے لہ کاٹنے ہے THK.
0,Ranjith کی کیل drpd Deeraj اور دیپک 5min میں ہولڈ
0,"\ چیرس FOR سے Callin BABE.SOZI CULDNT TALKBUT میں WANNATELL U تفصیل آگے WENWECAN CHAT مناسب طریقے X \ """""
0,ارے U جم میں اب بھی؟
0,اس نے کہا، '' U کوئی اعتراض تو نہیں میں نے ایک منٹ کے لئے بیڈروم میں جانے تو کیا ہوگا؟ '' '' ٹھیک ہے ''، میں نے ایک سیکسی موڈ میں لیکن. وہ، 5 minuts latr ایک کیک wid سے باہر آئے ... این میری بیوی
0,بہت بہتر ہے اب شکریہ LOL
0,کچھ نہیں، smsing یو این XY ہے Lor. معذرت ہے Lor شخص میں نیوا یو سی دا لوگ لیکن وہ ایک طرح سے یو جانتے ہے Lor. یو وان تو 2 سے ملو تو انہیں مجھے 2 پوچھنا XY 4 ہمارے اگلے اجلاس کے ساتھ ساتھ یو لاتے ہیں.
0,سے Lemme میں یہ سب سمسٹر 1 کے بعد کسی بھی وقت بنیادی طور پر آزاد ہوں، میں کی طرف سوئنگ اور اٹھا سکتے ہیں جب آپ کو معلوم
0,و ... U اتنی موثر ... جی ... شکریہ ...
1,3. آپ کو آپ کے موبائل مواد موصول ہوئی ہے. کا لطف اٹھائیں
0,S لیکن سونے کے قابل نہیں.
1,30 سیکنڈ میں واضح جنسی چاہتے ہیں؟ رنگ اب 02073162414! اخراجات 20P / منٹ
0,ہم جلد ہی شہزادی سے ملاقات کریں گے! Ttyl!
0,میں آپ کو اب بھی آنے کے لئے چاہتے ہیں تو 5.15pm ٹاؤنٹن میں جانے کے لئے کے بارے میں آپ کو لینے دیں گے.
0,اوہ :-) صرف 4 کے باہر کھلاڑیوں کو معلوم کھیلنے کی اجازت
0,مجھے کچھ بھی ہے Lor.
0,Erutupalam thandiyachu
0,Y یو مذاق نہیں کر fly..i'm کو نئی ایجاد کی کوشش نہیں کر سکتے.،
0,نغمہ کی غزلیں سے ∎ کا No..its ..
0,یو یہ نہیں کر سکتے تو آپ کی ضرورت ہے 2 کے طور پر کیا گننا کرتے ٹرانسپورٹ کے بندوبست، شکریہ
0,یہ سچ ہے کہ شکار مکمل ن نگہداشت nevr غیر شناخت شدہ جانا جایئں. جو قدر کرنا جب somone اکثر غلطی کرتا ہے اگرچہ. لیکن وہ definitly undrstnd وہ اسے لاپتہ شروع کرنے پر ایک بار کریں گے.
0,خریداری؟ اہ GER میں toking ABT سڈ لہ ... ہا ہا
0,کیا نہیں تحت کھڑے.
0,* اچھا ہفتے کے آخر میں ہے.
0,مس کال مس کال khelate kintu مس کال dhorte Lage کی opponenter. آئی حکمرانی کروں گا. عظیم فون وصول معیار جیت کے ساتھ ایک.
0,مجھے فون کرتے وقت آپ کو موقع تو plz کریں & lt حاصل؛ 3
0,نئے Deus سابق کھیل آ اگلے سال
0,# & gt؛ پر میرا کمپیوٹر صرف ہم میری، اتارنا fucking کمینے کمرے میں رہتے مکمل کریں & lt پر چلنے چیز چھوڑ کر looovvve وجہ سے پرجوں نہیں رکھتے صرف ضروری حصہ تلی ہوئی؛ / 7
0,میرے دوست، وہ واروک میں زیر تعلیم ہیں، ہم خریداری اور کنسرٹ TMW پر جانے کے لئے منصوبہ بندی کی ہے، لیکن یہ منسوخ ہو سکتی ہے، havn't عمر کے لئے دیکھا، ہاں ہم کچھ دیر ایک دوسرے کے ساتھ ہو جانا چاہئے!
0,شاید ایک جوڑے گھنٹے چوٹیوں
0,LOL .. * grins کے * .. میں بیب نہیں کر رہا ہوں، لیکن میرے بارے میں سوچ کے لئے شکریہ!
0,انسان اس بس اتنی اتنی سست تا ہے. میں نے آپ کو مجھ سے پہلے وہاں حاصل کرنے والے ہیں لگتا ہے کہ
0,اس متن تم مسکرا ملاقات کی امید ہے. نہیں تو پھر تو یہ متن آپ مسکرا کے لئے ایک وجہ دے دو. ایک خوبصورت دن ہے.
0,صورت میں آپ جہاں بھی ہوں سوچ جاگنا، مجھے آج میں دادی کے لئے کسی چیز کا خیال رکھنا پڑتا ہے، پریڈ سے پہلے کیا جانا چاہئے بھول گیا
0,ٹھیک ہے
